disease_name,gene_name
AIDS,PGR; RBX1; TUBB4A; CYP3A5; TUBB2A; IFNAR1; CCR5; CYP3A7; TUBB4B; CFTR; ALOX5; CYP3A43; TOP2B; NR3C1; ANO1; IL2RA; IFNAR2; CYP3A4; DDB1; AR; TUBB6; TUBB; TLR7; TUBB8; ESR1; IL2RB; VDR; CRBN; TOP2A; PDE5A; CUL4A; MS4A1; TUBB3; PTGS2; PTGS1; TUBB1; HMGCR; PPARG; TUBB2B
AL amyloidosis,CD38; PSMB5; TTR; MMP13; CUL4A; DDB1; TUBB6; TUBB4B; SLAMF7; RBX1; CSF3R; MMP1; TUBB8; TNFRSF17; KCNH2; TUBB4A; CRBN; MMP8; TUBB2A; MMP7; TUBB1; NR3C1; TUBB2B; TUBB; TUBB3
Abdominal Aortic Aneurysm,NDUFS1; NDUFB2; NDUFA8; NDUFA10; SCN2A; NDUFAF1; SCN1A; NDUFB11; NDUFB9; NDUFS2; NDUFA3; NDUFA6; PPIA; NDUFS3; NDUFA7; ADRB1; NDUFC1; HMGCR; GPD2; NDUFS7; PLG; NDUFAF4; NDUFA2; NDUFB5; AGTR1; CACNA1C; NR3C2; CACNA1D; NDUFAF2; NDUFB8; SCN11A; NDUFS5; SCN9A; NDUFV2; SCN5A; NDUFA4L2; MT-ND4; MT-ND1; NDUFB4; MMP8; NDUFB3; NDUFA1; IL1B; SCN7A; MMP7; MMP13; NDUFV3; NDUFV1; NDUFA11; NDUFAF3; NDUFB1; NDUFA12; SCN10A; NDUFA4; MT-ND5; MT-ND4L; NDUFAB1; SCN4A; CACNA1S; NDUFB7; CACNA1F; NDUFS8; SERPINC1; NDUFA5; NDUFA9; NDUFB10; NDUFS6; NDUFC2; SCN3A; ACE; NDUFS4; NDUFB6; P2RY12; NDUFA13; MMP1; SCN8A; MT-ND6; MT-ND2; MT-ND3
Abdominal pain,PTGS2; VDR; NR3C1; SCN3A; CHRM1; SCN5A; CNR2; HRH1; SCN8A; OPRM1; SCN7A; SCN1A; CACNA2D1; SCN9A; SCN10A; PPARA; TACR2; PTGS1; FAAH; NGF; FDPS; SCN11A; ADRB2; SCN4A; SCN2A; TRPV1
Abnormal blood glucose concentration,NDUFB4; GPD2; NDUFB3; NDUFA5; NDUFB11; NDUFB9; NDUFC2; NDUFA3; NDUFB1; NDUFA6; NDUFA4; MT-ND5; MT-ND4; NDUFAB1; NDUFB7; NDUFC1; NDUFS8; NDUFS7; NDUFA1; NDUFB5; NDUFAF1; NDUFB10; NDUFS4; NDUFB6; NDUFAF3; NDUFA12; MT-ND6; MT-ND1; NDUFA7; NDUFB2; NDUFAF4; FFAR1; NDUFA10; NDUFA2; NDUFS6; NDUFS2; NDUFV3; NDUFAF2; NDUFV1; NDUFS5; INSR; NDUFA11; NDUFV2; NDUFA13; MT-ND2; NDUFS3; NDUFS1; NDUFA8; NDUFA9; NDUFB8; NDUFA4L2; DPP4; MT-ND3; MT-ND4L
Abnormal cardiovascular system morphology,GRIN2D; GRIN3B; THRB; P2RY12; SCN5A; GRIN3A; SCN7A; SCN1A; SCN11A; GRIN2A; GRIN2B; SCN4A; THRA; SCN2A; NPR1; PDE3A; GRIN1; SCN8A; PDE5A; SCN3A; GRIN2C; SCN9A; SCN10A
Abnormality of blood and blood-forming tissues,IL5RA; AVPR2; VKORC1; TOP2B; FKBP1A; GSR; CUL4A; DDB1; FGB; IMPDH2; RBX1; IMPDH1; CRBN; CSF3R; FGA; F2; AVPR1B; CSF2RA; TOP2A; AVPR1A; FGG; RRM2
Abnormality of connective tissue,COL4A4; COL1A1; COL4A2; COL2A1; COL1A2; COL4A3; COL6A5; COL4A5; COL27A1; COL4A6; COL11A2; COL28A1; COL11A1; COL5A1; COL6A1; COL6A3; COL3A1; AR; COL4A1; COL5A2; COL15A1; COL6A6; SNAP25; COL6A2; COL18A1; COL5A3; COL24A1
Abnormality of the skin,SCN1A; SCN3A; SCN10A; SCN4A; SCN2A; SCN7A; SCN9A; SCN5A; SCN11A; SCN8A
Achalasia,NR3C1; SNAP25; CHRM2; GUCY1B1; CHRM3; CHRM1; GUCY1A2; GUCY1A1; OPRM1; nan
Acute kidney injury,GABRA3; GSK3B; KCNK10; PDE4C; MET; HMGCR; PDE4D; TNNC1; PTGER2; AVPR2; TNNI3; IMPA1; MTNR1B; GABRA6; ADRA2A; GABRA2; PDE3B; PDE9A; GABRG1; ADORA1; AVPR1A; NPR1; KCNK9; ADRA1B; ADRA1D; PDE6G; PDE2A; PPIA; AVPR1B; PDE7A; MC1R; GABRQ; GABRA1; PDE4A; PDE8A; SLC12A1; GABRP; GABRE; GSK3A; PDE10A; PDE8B; GABRG2; PDE1A; SERPINC1; TNNT2; ADRA1A; MC3R; ADORA2A; SLC5A2; TP53; XDH; GABRB3; INSR; PDE7B; PDE3A; GABRA5; KCNK18; EPOR; ADORA3; KCNK2; PDE6C; FGF1; PDE1B; PDE6A; PDE6B; PDE5A; PDE6H; GABRB2; GLRA1; NR3C2; PDE6D; GABRB1; MTNR1A; ADORA2B; GABRG3; ADRA2C; PDE4B; DRD1; GABRD; ADRA2B; GUCY1B1; GABRA4; VDR; nan; AGTR1; PDE1C; PTGER1; KCNK3
Adenomyosis,PTGS2; PGR; PTGS1; GNRHR; FAAH; OXTR; TRPV1; ESR1; NR3C1; CYP19A1
Agitation,SCN4A; GABRA3; GABRA1; KCNK10; GABRA4; OPRM1; ALDH5A1; GABRG2; GRIN3B; SCN7A; SCN1A; HTR2C; DRD2; DRD3; GABRA2; GABRG1; GRIN1; GABRG3; SCN5A; ADRA2C; ADRA2B; DRD4; KCNK2; HTR2A; GRIN2D; SLC6A4; MTNR1B; SCN2A; ADRA2A; GRIN2C; SCN11A; SCN9A; CHRNA7; HTR1A; GABRA5; CHRNG; SCN8A; GABRP; GABRE; CHRNE; OPRD1; CHRND; CHRNA1; GLRA1; SCN3A; HTR4; GABRB3; MTNR1A; GRIN2A; GABRD; GABRQ; GRIN2B; OPRK1; GABRA6; GABRB2; GABRB1; CHRM1; KCNK9; CHRNB1; KCNK3; SCN10A; KCNK18; GRIN3A
Airway obstruction,PDE4C; PDE4D; ADRA1A; ADRB2; ADRA1B; ADRA2C; PDE4B; IGHE; ADRA2B; ADORA3; ADRB1; PDE10A; IL5; ADORA2A; PDE3B; CYSLTR1; PDE4A; NR3C1; TSLP; ADORA1; ADORA2B; ADRA1D; PDE3A; IL5RA; CHRM3; PDE5A; ADRA2A; CHRM1; ADRB3
Albright hereditary osteodystrophy,GHR; PDE4D; ADORA2B; PDE4A; PDE4C; PDE3B; ADORA1; ADORA2A; PDE3A; PDE4B; ADORA3
Alport syndrome,RPS20; RPLP0; RPL18A; NDUFC1; RPL34; GPD2; RPS15; NFE2L2; NDUFAF4; RPL23; RPLP1; RPS24; NDUFB10; RPS3A; NDUFB11; RPL7A; FAU; NDUFV3; NDUFAF2; RPL13; RPS21; RPL38; NDUFV2; RPS17; NDUFA12; NDUFA6; NDUFA4L2; RPL23A; MT-ND5; MT-ND3; MT-ND1; MT-ND4L; RPS29; KEAP1; NDUFS8; RPS25; PPARG; RPL35; RPS6; NDUFA9; RPS2; RPS11; RPL32; AGTR1; NDUFS6; RPS3; RPL30; NDUFS2; NDUFS4; NDUFB6; RPL4; NDUFAF3; RPL35A; RPL10A; MT-ND2; MT-ND4; NDUFS3; RPL41; RPS18; RPS28; RPL17; NDUFA7; NDUFAB1; RPL18; NDUFB4; RPL6; NDUFB2; NDUFB7; RPL3; RPS19; RPS13; RPS12; RPL24; NDUFS7; RPL22; NDUFB3; NDUFA8; RPL21; RPL5; NDUFA5; RPS4Y1; NDUFA10; RPL27; RPL11; RPL10; RPL7; NDUFB9; RPL26; RPL9; RPS14; NDUFB8; RPSA; RPS9; RPL15; RPS27; RPS23; RPL14; RPL37A; RPS4X; MT-ND6; RPL36A; NDUFS1; RPL31; RPS5; IKBKB; RPS16; RPL28; RPL19; HMGCR; RPS10; NDUFA1; RPL36; NDUFA2; RPS15A; NDUFB5; NDUFAF1; RPL13A; RPS8; RPS27A; RPL37; NDUFC2; ACE; RPL8; RPL29; RPL27A; NDUFV1; NDUFS5; NDUFA3; RPS7; NDUFA11; NDUFB1; NDUFA13; NDUFA4; RPS26; RPL12; RPL39; nan
Alzheimer disease,SCN4A; FGFR3; DRD4; PSEN1; CACNA1S; ESR1; PTGS1; RBX1; HRH3; HTR2A; SLC6A2; SLC6A4; PPARD; MAPK14; PDE4D; BCHE; APH1A; HSD11B1; GRIA2; CHRNA10; MTNR1B; HCRTR2; APH1B; APP; SLC6A3; PSEN2; GABRA6; GABRB2; PLA2G7; DRD3; GABRA2; CACNA2D1; HTR6; IFNAR2; ACE; PDE9A; NCSTN; GABRB3; MTNR1A; ADRB2; CHRNA5; RARG; CHRNA7; GRIN1; HTR1A; GABRG3; GRIN2A; ADRA2C; BACE1; GRIN3A; AGER; GABBR1; TNF; GABRA3; GABRA1; RARB; PGR; ACHE; IL2RB; GSK3A; GABRA4; VDR; ALDH5A1; HMGCR; GABRG2; NR3C1; PDGFRB; CRBN; GRIN3B; MMP8; ADORA2A; IL2RA; SCN2A; GABBR2; CUL4A; SCN1A; AGTR1; HTR2C; CHRNA6; SIGMAR1; HTR3B; GRIA4; SCN3A; CACNA1D; KIT; GRIN2C; HTR4; PAH; SCN10A; BCR; ADRB3; MMP1; SCN8A; SRC; GABRQ; GRIN2B; PTGS2; ABL1; CHRNA4; GRIN2D; GLP1R; FAAH; ADRA1A; HCRTR1; PDE5A; ESR2; IFNAR1; RXRG; CACNA1B; DRD2; ADRA2A; CACNA1C; GRIA1; GABRG1; ADORA1; HTR3A; DDB1; SCN11A; SCN9A; ADORA2B; ADRA1D; CYSLTR1; HTR3C; CHRM2; GABRA5; GABRD; TRPV1; FLNA; RXRB; PSENEN; ADRA2B; CD38; ADRB1; MAOB; GSK3B; CETP; GABRP; CACNA1F; GABRE; GNRHR; CNR1; GRIA3; RARA; PPARG; CHRM3; IMPA1; PDGFRA; SCN7A; MMP7; MMP13; SV2A; CHRNB2; GABRB1; CHRM1; ADRA1B; INSR; PDE3A; CHRNA9; SCN5A; HTR3E; HTR3D; RXRA; MAPT; CSF2RA; ADORA3
Anal Squamous Cell Carcinoma,TUBB4A; TUBB2A; CTLA4; PDCD1; TUBB1; TUBB6; TYMS; TUBB4B; TUBB2B; TUBB; TUBB3; TUBB8
"Anemia, Hemolytic, Autoimmune",FCGR2B; PSMB5; NR3C1; PIK3CD; MS4A1; CD19; PPIA; SYK; CD52; C1S; BTK; FKBP1A; FCGRT; TNFRSF13C
Angelman syndrome,GABRA3; GABRA1; GABRA4; GABRA6; GABRB2; GABRA2; GABRB3; GABRB1; DRD3; GABRA5
Anorexia,TUBB2A; HTR2C; DRD2; DRD3; HTR3A; TUBB; DRD4; PGR; ALDH5A1; CNR1; ADRA2A; HTR4; ADRA2C; TUBB8; TUBB1; HTR2A; TUBB2B; TUBB6; TUBB4A; TUBB4B; TNF; TUBB3; ADRA2B
Aphasia,ACHE; DRD3; GRIN3A; SLC6A4; GRIN1; GRIN2A; GRIN2B; GRIN3B; DDC; GRIN2D; GRIN2C
Aplastic anemia,POLD3; TGFB2; POLE2; POLA1; NR3C1; CSF3R; TGFB3; PRIM2; MS4A1; CD52; PPIA; MPL; CXCR4; DNMT1; IL2RA; POLE3; RRM1; POLD4; PRIM1; POLA2; FKBP1A; TGFB1; IMPDH1; POLD2; DNMT3A; IMPDH2; DHFR; POLD1; POLE
Apnea,ADORA1; HTR1A; ADORA3; CA2; ADORA2A; PDE3B; CA4; KCNK3; PDE4B; PDE4A; CA12; KCNK9; ADORA2B; PDE3A; PDE4C; PDE4D; CA1
Arthralgia,PTGS2; XDH; ADRA1B; ADRA1D; HRH1; PTGS1; NR3C1; ADRA2A; ADRA2C; TRPV1; ALOX5; HRH2; ADRA1A; TRPA1; TRPM8; ADRA2B
Arthropathy,PTGS2; CHRND; SCN2A; SCN7A; SCN3A; SCN9A; SCN8A; SCN4A; CHRNE; PLG; CHRNA1; SCN1A; OPRK1; OPRM1; NR3C1; SCN11A; CHRNB1; SCN5A; OPRD1; SCN10A; CHRNG
Ascites,NDUFB7; ADRA1A; KDR; NDUFA9; NDUFS6; NDUFAF2; NDUFB6; NDUFB8; NDUFS5; NDUFA3; MT-ND4; NDUFAB1; NDUFS1; FLT4; ADRB1; NDUFS8; VEGFA; PDGFRB; NDUFA8; PDGFRA; NDUFAF1; NDUFB10; NDUFC2; KIT; NDUFS4; RET; NDUFAF3; NDUFV2; NDUFA12; NDUFA6; NDUFA4; MT-ND5; MT-ND3; MT-ND1; NDUFB2; FLT1; NDUFC1; NDUFS7; NDUFB3; EPCAM; FLT3; NDUFA1; AVPR2; NDUFB11; NDUFB9; CD3G; ADRB2; ADRA1B; ADRA1D; NDUFA11; CSF1R; NDUFA13; CD3E; NDUFA7; NDUFB4; GPD2; NDUFAF4; NDUFA5; NDUFA10; NDUFA2; NDUFB5; SLC5A2; NDUFS2; NDUFV3; CD3D; NDUFV1; NDUFB1; NDUFA4L2; MT-ND6; MT-ND2; MT-ND4L; NDUFS3
Asperger syndrome,HTR2C; DRD2; GRIN2C; GRIN1; GRIN3A; GRIN2B; HTR2A; SLC6A2; SLC6A4; GRIN3B; HTR1A; GRIN2A; GRIN2D
Ataxia-telangiectasia,NDUFB2; NDUFS7; NDUFA1; NDUFA2; PPARG; NDUFB10; NDUFB9; NDUFA4L2; MT-ND1; GPD2; NDUFB3; NDUFAF1; NDUFS6; NDUFB11; NDUFAF2; NDUFA3; NDUFA11; NDUFA13; MT-ND4; NDUFS1; NDUFC1; NDUFS8; NDUFA8; NDUFAF4; NDUFA9; NDUFC2; NDUFS2; NDUFV1; NDUFV2; NDUFB1; NDUFA12; NDUFA6; NDUFA4; MT-ND6; MT-ND5; NDUFS3; NDUFAB1; NDUFB4; NDUFB7; NDUFA5; NDUFA10; NDUFB5; NDUFV3; NDUFS4; NDUFB6; NDUFB8; NDUFS5; NDUFAF3; MT-ND2; MT-ND3; MT-ND4L; NDUFA7
Autosomal dominant polycystic kidney disease,CACNA1S; NDUFB2; ABL1; NDUFB7; HCK; CACNA1F; IKBKB; NDUFS8; HMGCR; GPD2; NFE2L2; NDUFA8; NDUFA2; NDUFB5; NDUFAF1; NDUFB9; CACNA1D; NDUFV3; SSTR5; NDUFS4; NDUFB6; NDUFB8; NDUFV1; NDUFA3; NDUFAF3; NDUFV2; BCR; SRC; MT-ND2; SSTR3; SCNN1A; NDUFS7; NDUFB3; NDUFAF4; NDUFA1; PPARG; ERBB2; NDUFS6; NDUFB11; UGCG; NDUFC2; NR3C2; NDUFS2; ACE; NDUFA11; SSTR2; NDUFA12; NDUFA6; NDUFA13; EPHB4; MT-ND6; MT-ND3; MT-ND4; MT-ND1; MT-ND4L; NDUFS3; NDUFAB1; NDUFS1; FKBP1A; NDUFC1; AVPR2; NDUFA5; NDUFA10; SSTR4; SSTR1; SLC5A2; NDUFB10; CACNA1C; NDUFS5; NDUFB1; NDUFA4L2; NDUFA4; MT-ND5; LYN; NDUFB4; SLC12A3; KEAP1; NDUFA9; AGTR1; EGFR; NDUFAF2; NDUFA7
B-Cell Prolymphocytic Leukemia,POLA1; PRIM2; POLE; POLE2; POLD2; RRM1; PRIM1; POLA2; POLD1; POLD3; IMPDH1; POLD4; IMPDH2; POLE3; PPIA
B-cell acute lymphoblastic leukemia,POLD1; TUBB4A; POLE3; CD3G; CD3D; POLD4; PRIM1; CD3E; CD22; POLD3; POLE2; POLA1; TUBB2A; TUBB6; CD19; TUBB; POLA2; PSMB5; TUBB1; POLD2; NR3C1; CSF3R; TUBB2B; POLE; TUBB4B; TUBB3; TUBB8; TOP2A; PRIM2; DHFR
Back pain,SCN4A; GABRA3; GABRA1; PTGS2; SLC6A2; DDC; CHRND; SCN2A; SCN1A; DRD3; GABRB1; CHRNB1; SCN5A; KCNK18; HRH1; SCN8A; ADORA3; GABRP; PTGS1; TRPA1; SLC6A4; GABRA4; OPRM1; NR3C1; NGF; SCN7A; TRPM8; GABRA2; FDPS; PTH1R; GABRG1; ADORA1; CHRM1; SCN9A; GABRG3; TRPV1; GABRQ; KCNK2; GABRE; ADORA2A; GABBR2; CHRNA1; GABRB2; GLRA1; SCN3A; KCNK3; CHRNG; OPRK1; KCNK10; CHRNE; GABRG2; FAAH; GABRA6; GABRB3; SCN11A; KCNK9; ADORA2B; SCN10A; GABRA5; GABRD; GABBR1
Bardet-Biedl syndrome,NDUFB3; NDUFAF4; NDUFB5; NDUFB10; NDUFA3; MT-ND6; MT-ND2; MT-ND5; NDUFAB1; NDUFB11; MC4R; NDUFV1; NDUFS5; NDUFA12; NDUFA4L2; MT-ND3; NDUFB2; NDUFS8; NDUFA8; NDUFB9; NDUFS2; NDUFV3; NDUFS4; NDUFA11; NDUFAF3; NDUFV2; NDUFA6; NDUFA13; NDUFA4; MT-ND4; MT-ND1; NDUFS1; NDUFB4; NDUFB7; NDUFC1; GPD2; NDUFS7; NDUFA1; NDUFA5; NDUFA10; NDUFA2; NDUFAF1; NDUFA9; NDUFS6; NDUFC2; NDUFAF2; NDUFB6; NDUFB8; NDUFB1; MT-ND4L; NDUFS3; NDUFA7
Becker muscular dystrophy,RPS5; RPLP0; RPL3; RPS16; RPL18A; RPL28; RPL19; RPL34; RPS13; RPS12; RPL24; RPS15; RPL22; RPS25; RPL21; RPL5; RPS10; RPL36; RPLP1; RPS2; RPS8; RPL32; RPS3A; RPL37; RPL10; RPL7; RPS3; FAU; RPL30; ACE; RPL26; RPL29; RPL9; RPS14; RPL27A; ADRA1B; RPS9; RPL38; RPL15; RPS27; RPS17; RPL35A; RPS26; RPL37A; RPL12; RPL10A; RPS29; RPL41; RPL36A; RPS20; RPL18; RPL31; RPS19; ADRA1A; RPL23; RPS4Y1; RPL27; RPL35; RPS6; RPS24; PDE5A; RPS11; RPS27A; RPL8; RPL13; RPSA; ADRB2; RPL4; RPS4X; RPS18; RPS28; RPL17; ADRB1; RPL6; RPS15A; RPL13A; RPL11; RPL7A; RPS21; RPS7; ADRA1D; RPS23; RPL14; RPL23A; ADRB3; RPL39
Behcet's syndrome,TUBB4A; PDE4C; IL6R; PDE3A; TUBB3; PDE4A; PDE8A; PDE6C; TUBB1; IL17A; PDE8B; IL12B; PDE4D; PDE1A; IL1B; TUBB2A; TUBB2B; IFNAR1; IL18; PDE3B; MS4A1; PDE4B; TNF; PDE6A; PDE6B; IL2RA; PDE5A; PDE1C; PDE6D; IFNAR2; PDE9A; ADORA2B; PDE7B; TUBB6; PDE2A; PPIA; TUBB8; IL2RB; PDE10A; PDE1B; ADORA2A; PDE6H; PDE6G; TUBB4B; TUBB; PDE7A
Beta-thalassemia,POLD1; TGFB1; CUL4A; POLE3; DDB1; HBB; POLE2; POLA1; DNMT3A; PDE5A; PRIM2; POLD4; PRIM1; ADRB1; TGFB2; POLD2; CRBN; TGFB3; DNMT1; CD52; RRM2; POLE; EPOR; POLA2; POLD3; FKBP1A; RBX1; PKLR; PDE9A; FDPS; RRM1; SLC6A9
Bilateral tonic-clonic seizure,SCN2A; CACNA1B; GRIA1; SV2A; SCN11A; SCN3A; SCN10A; SCN4A; GRIA2; GRIA3; GRIA4; SCN9A; SCN5A; SCN7A; SCN1A; CACNA2D1; SCN8A
"Blast Phase Chronic Myelogenous Leukemia, BCR-ABL1 Positive",PRKCQ; ABL1; NR3C1; PDGFRB; FLT3; PRKCI; BCL2; DHFR; POLA2; PRKCH; POLD1; TUBB1; POLA1; DNMT3A; PRKCG; KDR; DNMT1; TOP2A; PDGFRA; PRKCA; PRKCD; POLD4; PRKD1; PRIM1; PRKCZ; POLD3; POLD2; PRIM2; POLE3; AXL; PRKCE; TUBB6; BCR; TUBB3; TUBB8; POLE2; TUBB4A; PRKD3; TUBB2A; TUBB2B; MS4A1; KIT; PRKCB; POLE; TUBB4B; TUBB
Borderline personality disorder,MAOB; PTGS1; HTR2A; GRIN2D; SLC6A4; GABRG2; GRIN3B; OPRD1; FAAH; SCN2A; DRD2; SCN3A; SCN11A; GRIN2A; GABRA5; DRD4; PTGS2; NR3C1; HTR2C; GRIN2C; GABRG1; GRIN1; HTR1A; GABRG3; GABRA3; PGR; OPRK1; OPRM1; SCN7A; SCN1A; SCN9A; SCN5A; SCN10A; TRPV1; GRIN3A; SCN4A; GABRA1; SNAP25; DRD3; GABRA2; SCN8A; GRIN2B
Bradycardia,CHRNE; CHRM3; ADRA2C; ADRB3; ADRB1; CHRND; CHRNA1; ADRA2A; ADRB2; CHRNB1; CHRM1; CHRM2; ADRA2B; ADRA1A; ADRA1B; ADRA1D; CHRNG
Bronchiectasis,PDE4A; CTSC; NR3C1; PDE3B; ADRB2; PDE4B; ELANE; PDE4C; ADORA2A; CHRM3; ADORA1; IL5RA; VDR; HMGCR; PDE4D; ADORA2B; PDE3A; ADORA3; CHRM1
Bronchiolitis,SLC12A1; ADRA1A; nan; ADRA1B; ADRA1D; CYSLTR1; ADRA2B; ADRB1; GUCY1B1; NR3C1; ADRB3; VDR; ADRA2A; ADRB2; ADRA2C
Bronchospasm,GRIN2D; OPRM1; NR3C1; ADRB2; CYSLTR1; GRIN2A; GRIN3A; GRIN2B; GRIN3B; CHRM3; GRIN2C; GRIN1
Brugada syndrome,KCNQ2; KCND1; KCNA7; KCNS1; KCNC3; KCNH3; KCNB1; KCNF1; KCNG4; KCNH8; KCNQ3; KCND2; KCNH7; KCNQ1; KCNA1; KCNA5; KCNH5; KCNA10; KCND3; KCNA2; KCNG2; KCNG1; KCNC4; KCNQ4; KCNC1; KCNH1; KCNA6; KCNS2; KCNC2; KCNS3; KCNH6; KCNB2; SCN5A; KCNQ5; KCNH2; KCNH4; KCNV1; KCNV2; KCNG3; KCNA3; KCNA4
Burkitts lymphoma,FKBP1A; IL2RB; HDAC10; POLE2; IMPDH1; CSF3R; TOP2A; TUBB2A; IMPDH2; TUBB; TUBB3; HDAC7; HDAC4; TOP2B; POLD2; NR3C1; IL2RA; MS4A1; HDAC11; POLD4; TUBB6; TUBB4B; PPIA; CSF2RA; TUBB8; POLA2; HDAC9; HDAC6; TUBB1; POLA1; TUBB4A; HDAC5; HDAC8; POLE3; RRM1; HDAC3; HDAC2; PRIM1; BTK; POLD1; POLD3; HDAC1; TUBB2B; PRIM2; POLE; DHFR
CDKL5 disorder,GABRG2; GABRB3; GABRG3; GABRD; GABRA4; GABRA2; GABRG1; GABRA5; GABRA1; GABRE; GABRA6; GABRB1; GABRQ; GABRA3; GABRP; GABRB2
COVID-19,NDUFAB1; BTK; FYN; GABRA1; NDUFS1; KCNH2; GUCY1B1; NDUFB4; PDE4A; DRD4; PDE8A; PTGS2; RARB; TOP2B; IL4R; NDUFB2; ESR1; ANGPT2; GABRP; PTGS1; HSP90AB1; ABL1; IL2RB; RBX1; TUBB1; CHRNA4; EEF1A2; CSNK2A1; HCK; GABRE; TUBB4A; GRIN2D; JAK3; CDK6; CYP3A5; IMPDH1; GCK; SLC6A4; GNRHR; CTSC; NDUFS8; IL23A; ALDH2; VDR; OPRM1; GHR; HMGCR; PDE4D; NR3C1; CRBN; NCBP2; GPD2; TACR1; IL1R1; IL1RL1; FASLG; SERPINC1; NDUFB3; CD80; FLT3; PLG; PDE1B; NDUFAF4; NDUFA1; SRMS; IL1B; SRD5A3; NDUFA5; NDUFA10; F12; NDUFA2; RARA; PPARG; PDE6A; CHRM3; KLRC1; NDUFB5; BLK; TUBB2A; MMP13; IFNAR1; EPHA2; SCN1A; AGTR1; SRD5A1; PIK3R1; GABRA6; GLRA1; NDUFB11; PDE3B; IL6R; CCR5; CYP3A4; CYP3A7; GRIN2C; JAK1; NDUFS4; KLKB1; CSF2; NDUFB8; GABRB3; AXL; NDUFV1; NDUFS5; AR; P2RY12; CXCL8; ADRA1B; S1PR1; INSR; RARG; CYSLTR1; SELP; TUBB6; GRIN1; NDUFAF3; NDUFV2; S1PR5; GRIN2A; NDUFB1; ADRA2C; NDUFA12; NDUFA6; IFNLR1; PDE6G; NDUFA13; GABRA5; PDE2A; PPARA; GABRD; TUBB4B; NDUFA4; TUBB; MMP1; TLR7; TRPV1; ELANE; CSF2RA; MT-ND6; MT-ND5; CD3E; MT-ND1; BRD2; PDE7A; NDUFS3; TLR9; IL10RB; TUBB3; TUBB8; S1PR2; GABRQ; FGR; MASP2; GABRA3; CYP3A43; ADRB1; PIK3CB; CALCRL; FGFR2; CACNA1S; XPO1; ACHE; F11; PDE6C; JAK2; NDUFB7; KCNN4; PIK3R2; PDE4C; C5; GABRA4; NDUFC1; PDE10A; VEGFA; SLC29A1; PDE8B; HRH2; CD86; PIKFYVE; PDE1A; GRIN3B; PIK3R3; FAAH; CSF3R; ADRA1A; TREM1; F10; KDR; DNMT1; TOP2A; AGT; NDUFAF1; BRDT; PDE5A; PDE6H; CUL4A; ESR2; SIGLEC10; NDUFS6; GABRB2; EGFR; ADM; CACNA1C; NDUFC2; NR3C2; SCN3A; LY96; PDE1C; PDE6D; NDUFS2; NDUFV3; CHRNB2; FGFR4; GABRG1; CXCR1; NDUFAF2; DDB1; SLC22A11; SCN11A; CHRM1; PCSK9; CD14; ADRA1D; PDE3A; YES1; C1S; SCN5A; SCN10A; NDUFA4L2; KCNK18; HRH1; DPP4; IRAK4; MT-ND4; AGER; ITGB3; NDUFA7; GRIN2B; ADRA2B; ADORA3; SCN4A; CD6; FLT4; FGFR1; KEAP1; HSP90AA1; OPRK1; AKR1B1; FKBP1A; KCNK10; CACNA1F; FLT1; DHODH; IKBKB; TYK2; PIK3CG; FRK; IL17A; GABRG2; NDUFS7; NFE2L2; OPRD1; MMP8; CCN2; NDUFA8; CCR2; PIK3CA; nan; PTGER2; S1PR4; MAS1; PDE6B; IL2RA; MTNR1B; CDK4; EDNRB; IL6; SCN7A; TLR4; NCBP1; TUBB2B; TLR2; MMP7; CASP1; SLC5A2; NDUFB10; PIK3R5; BRD4; NDUFB9; DRD2; ADRA2A; DRD3; EDNRA; GABRA2; CACNA1D; KIT; IFNAR2; PDE9A; GABRB1; SYK; NDUFB6; CD3D; BDKRB2; MTNR1A; ADRB2; KCNK9; BRD3; NDUFA3; KCNK3; PDE7B; F2; OXTR; GABRG3; LCK; PDE4B; MAPK11; BCR; PDCD1; HMGB1; IL1RAP; PPIA; SCN8A; CFD; SLC22A6; MT-ND2; GRIN3A; MTOR; MT-ND3; HSPA1B; MT-ND4L; SRD5A2; ITGA2B; TBXA2R; FGFR3; PGR; KCNK2; CETP; CSF2RB; TLR8; HTR2A; LTA4H; IFNG; MAPK14; PDGFRB; CNR1; DNMT3A; RAMP1; PDGFRA; SCN2A; NDUFA9; IL22RA1; SLC22A8; ACE; PTGIR; CD3G; PTGER1; NLRP3; PTGDR; SCN9A; PIK3CD; NDUFA11; CXCR2; PTGDR2; PLA2G2A; SRC; C5AR1; HSPA1A; IGHE; S1PR3; TNF; LYN
Cachexia,PGR; GHR; JAK1; TUBB4B; JAK2; TUBB4A; ACVR2B; GHSR; HTR2C; INSR; ADRA2C; TUBB3; TUBB1; HTR2A; IL6; TUBB2B; ADRA2A; TUBB6; ADRA2B; TUBB2A; AR; TUBB; TNF; TUBB8
Castleman disease,BTK; NR3C1; FKBP1A; RBX1; PSMB5; IL6; CRBN; TOP2A; IL6R; TOP2B; CUL4A; MS4A1; DDB1
Central Nervous System Lymphoma,TOP2B; PIK3CG; POLD2; NR3C1; PIK3CA; PRIM2; MS4A1; PIK3CD; POLD4; PRIM1; DHFR; BTK; POLA2; POLD3; POLE2; POLA1; PIK3R2; CRBN; CSF3R; CUL4A; POLE3; PDCD1; PIK3CB; RBX1; GSR; PIK3R3; GART; TYMS; POLE; POLD1; TOP2A; PIK3R5; PIK3R1; DDB1
Central Nervous System Neoplasm,POLA2; ABL1; TUBB1; POLA1; FLT1; GSR; TUBB4A; NR3C1; TUBA4A; TUBB2A; TUBB2B; CUL4A; EGFR; POLE3; GRIA1; TUBA1C; DDB1; RARG; POLD4; TUBB6; TOP1; TUBB3; TUBB8; POLD1; TOP2B; POLD3; PSMB5; DHODH; SERPINC1; FLT3; TOP2A; IL2RA; BDKRB2; RRM2; TUBB4B; TUBB; CSF2RA; TXNRD1; DHFR; FLT4; RRM2B; PTGS2; ACHE; ESR1; IL2RB; POLD2; VEGFA; FGF1; PDGFRB; KDR; PPARG; PRIM2; BRAF; RET; TUBA1A; BCR; RARB; FKBP1A; RBX1; POLE2; CRBN; CSF3R; GRIA2; TUBA1B; RARA; RAF1; TUBA3E; KIT; RRM1; POLE; TOP1MT; TUBA3C; PRIM1; CD3E
Charcot-Marie-Tooth disease,SCN2A; SCN1A; SCN10A; GABBR1; SCN4A; SCN7A; SCN11A; SCN9A; OPRK1; AKR1B1; OPRD1; OPRM1; GABBR2; SCN3A; SCN5A; SCN8A
Chemotherapy-induced nausea and vomiting,HTR2A; NR3C1; CNR1; HTR1B; HTR2C; ADRA2A; SCN3A; HTR3A; HTR1E; HTR3C; HTR1A; ADRA2C; HTR3E; HTR3D; DRD4; TACR1; SCN7A; HTR7; DRD2; HTR3B; HTR4; SCN5A; TRPV1; SCN2A; DRD3; HTR5A; HTR1D; SCN10A; SCN4A; HTR2B; SCN1A; HTR6; SCN11A; SCN9A; HTR1F; SCN8A; ADRA2B
Cholecystitis,GRIN2D; SCN2A; GRIN2C; HTR3A; SCN9A; GRIN2A; SCN5A; SCN8A; GRIN3B; ADRA2A; SCN7A; SCN11A; SCN10A; GRIN3A; GRIN2B; ADRA2B; SCN4A; OPRM1; SCN1A; SCN3A; GRIN1; ADRA2C
Chronic pain,SCN4A; PTGS2; OPRK1; PTGS1; CA2; GRIN2D; SLC6A4; OPRM1; CNR1; CHRM3; CA1; NGF; SCN2A; SCN7A; SLC6A3; DRD3; CACNA2D1; GRIN2C; HTR3A; SCN11A; GRIN1; SCN8A; ADRA2B; CA12; SLC6A2; NR3C1; GRIN3B; OPRD1; FAAH; SNAP25; SCN1A; SCN3A; CA4; SCN9A; GRIN2A; SCN10A; TRPV1; GRIN2B; DDC; ADRA2A; OXTR; SCN5A; ADRA2C; GRIN3A; CLCN2; CHRM2; HRH1
Cleft palate,SCN4A; PTGS2; OPRK1; OPRM1; OPRD1; ADRA2A; ADRA2C; ADRA2B; TRPV1; PTGS1; FAAH
Cognitive impairment,SCN4A; NDUFB4; GSK3B; ACHE; NDUFB2; NDUFB7; CHRNA4; GABRE; SLC6A2; GNRHR; VDR; OPRM1; GPD2; NDUFS7; CNR1; NDUFA8; ADRA1A; NDUFAF4; TUBA4A; NDUFA5; CHRM3; IMPA1; NDUFB5; SCN2A; NDUFAF1; APP; SLC6A3; SCN1A; NDUFS6; NDUFB11; GABRA2; SCN3A; NDUFS2; GRIN2C; GABRB1; NDUFB6; TUBA1A; NDUFV1; SCN11A; NDUFS5; ADRB2; SCN9A; ADRA1B; NDUFA3; INSR; TUBB6; GRIN1; NDUFV2; GRIN2A; NDUFA6; SCN10A; GABRD; NDUFA4; SCN8A; GRIN3A; MT-ND5; MT-ND3; MT-ND1; RXRB; MT-ND4L; ADRA2B; GABRA3; ADRB1; GABRP; PTGS1; TUBB1; GRIN2D; SLC6A4; NDUFC1; NDUFS8; MAPK14; NDUFB3; NDUFA1; NDUFA10; SCN7A; NDUFA9; GABRB2; HTR2C; NDUFB9; CACNA1B; ADRA2A; NDUFC2; NDUFV3; GABRG1; NDUFAF2; SLC18A2; TUBA1C; MTNR1A; CHRM1; ADRA1D; NDUFA11; CHRNA7; NDUFB1; SCN5A; NDUFA12; TUBB4B; TUBA3C; MT-ND6; NDUFS3; TUBB8; GRIN2B; NDUFAB1; GABRA1; NDUFS1; GSK3A; GABRA4; HMGCR; GABRG2; BCHE; GRIN3B; TUBA1B; S1PR4; ESR2; RXRG; AGTR1; SV2A; CHRNB2; CCR5; NDUFS4; NDUFB8; GABRB3; S1PR1; NDUFAF3; S1PR5; CHRM2; GABRG3; ADRA2C; NDUFA13; MT-ND2; S1PR3; TUBB3; S1PR2; NDUFA7; PTGS2; ESR1; HTR2A; TUBB4A; GHRHR; NDUFA2; PPARG; MTNR1B; TUBB2A; TUBB2B; NDUFB10; GABRA6; DRD2; TUBA3E; HTR6; PDE3A; NDUFA4L2; GABRA5; RXRA; ADRB3; TUBB; DPP4; MT-ND4; GABRQ
Constipation,SLC9A3; OPRM1; OPRD1; SLC10A2; SSTR1; HTR3B; HTR4; HTR3E; GUCY2C; OPRK1; CLCN2; SSTR5; HTR3C; RXRA; SSTR3; ACHE; ADRA1A; SNAP25; DRD2; ADRA1D; SSTR2; DGAT1; HTR3D; SSTR4; HTR3A; ADRA1B
Coronary Restenosis,FKBP1A; TUBB4A; TUBB6; TUBB1; TUBB2B; TUBB4B; TUBB; TUBB3; PTGS2; TUBB2A; TUBB8
Cough,GABRA1; KCNK10; TRPA1; ATP4A; P2RX3; OPRM1; GABRG2; NR3C1; GRIN3B; SCN2A; SCN7A; TRPM8; GABRB2; SCN11A; CYSLTR1; CHRNA7; GRIN1; GRIN2A; SCN5A; ADRA2C; KCNK18; HRH1; SCN8A; GABRQ; GRIN2B; SCN4A; KCNK2; RBX1; GABRE; HRH2; CRBN; TACR1; OPRD1; CUL4A; SCN1A; SIGMAR1; ADRA2A; GABRB1; GABRB3; DDB1; KCNK9; SCN10A; GABRD; TRPV1; SLC6A2; GRIN2D; ADRA1A; OPRL1; GABRA6; SCN3A; ADRB2; SCN9A; ADRA1B; KCNK3; GABRA3; OPRK1; GABRP; GABRA4; GLRA1; GABRA2; GRIN2C; GABRG1; ADRA1D; GABRG3; GABRA5; MAOA; GRIN3A; ADRA2B
Crohn's disease,SCN4A; ALOX5; PTGS2; TXK; PTGS1; IL2RB; PDE4C; ATP4A; POLD2; VDR; IL12B; PDE4D; NR3C1; IL1RL2; CSF3R; PPAT; PPARG; TEC; MMP13; IGF1R; IFNAR1; PRIM2; GABRA2; JAK1; ADORA1; CD52; ADORA2B; CCR9; IL17RA; PDE4B; IL1RAP; HRH1; CSF2RA; CD3E; DHFR; TNF; GABRA3; PDE4A; POLD3; OPRK1; FKBP1A; JAK2; MADCAM1; RBX1; MMP9; TYK2; IL17A; ITK; GABRG2; CD80; RARA; NCBP1; CUL4A; SLC6A3; IFNAR2; DDB1; IL13; S1PR1; POLD4; TLR7; PRIM1; ADORA3; CX3CL1; BTK; RARB; SMAD7; BMX; JAK3; IMPDH1; MAPK14; GHR; HMGCR; CRBN; NCBP2; PIKFYVE; ITGA4; OPRD1; MMP8; S1PR4; IL6; MMP7; ITGB7; SIGMAR1; GABRG1; RRM1; POLE; IMPDH2; S1PR5; CNR2; MMP1; POLA2; GABRA1; POLD1; GLP2R; ICAM1; POLE2; POLA1; SLC6A2; IL23A; OPRM1; CD86; ADORA2A; IL2RA; AGTR1; POLE3; CXCL10; GABRG3; GRIN2A; SCN5A; GABRA5; S1PR3; TLR9; S1PR2
Cushing syndrome,SOAT1; PGR; NR3C1; SSTR1; CYP11A1; CYP11B1; CYP11B2; PDE5A; CYP17A1; SSTR2; SSTR3; GNRHR; SSTR5
Cutaneous T-cell lymphoma,CD4; HDAC9; HDAC7; HDAC6; IL2RB; HDAC10; TLR8; HDAC1; HDAC11; RXRB; HDAC4; HDAC5; CUL4A; DDB1; HDAC2; TLR7; PNP; RBX1; NAMPT; RXRG; PRKCB; EEF2; HDAC3; CCR4; KEAP1; FKBP1A; CRBN; IL2RA; HDAC8; RXRA; PDCD1
Cutaneous abscess,SCN4A; SCN11A; SCN8A; SCN9A; SCN10A; SCN1A; SCN5A; SCN2A; SCN7A; SCN3A
Desmoid-type fibromatosis,FLT4; PSEN1; TUBB4A; PDGFRB; APH1A; TOP2A; PSEN2; NCSTN; TUBB3; RAF1; TUBB2A; KIT; RRM2; TUBB6; BCR; TUBB4B; ABL1; APH1B; BRAF; TUBB; PSENEN; DHFR; TUBB8; PTGS2; ESR1; PTGS1; TUBB1; FLT1; FLT3; KDR; TUBB2B; ESR2; RET
Diamond-Blackfan anemia,POLD1; POLD3; FKBP1A; POLA1; POLE; DHFR; POLD2; POLE3; PRIM1; POLA2; PRIM2; RRM1; POLE2; IMPDH1; POLD4; IMPDH2
Diarrhea,NR1H4; SSTR4; CFTR; OPRM1; TPH1; TPH2; SSTR1; SSTR2; SSTR3; NR3C1; ANO1; SSTR5; MME; GLP2R; PTGS2; PTGS1
Digestive System Carcinoma,FGFR2; MAPK1; MAPK3; CHRND; CHRNA1; EGFR; KIT; CHRNE; ANGPT1; BCR; CHRNG; FGFR3; PTGS2; KDR; PDCD1; TLR9; FLT4; FGFR1; ANGPT2; ABL1; FLT1; PDGFRB; PDGFRA; RET; CHRNB1; TYMS; TLR7; TOP1
Disorder of amino acid and other organic acid metabolism,RPL18A; RPL22; RPL23; RPS15A; RPL32; RPS3A; RPL37; RPL8; RPL29; RPS14; RPL27A; RPSA; RPS21; RPS27; RPL14; RPL12; RPS28; RPL18; RPL6; RPS16; RPS19; RPL34; RPS15; RPS25; RPL21; RPL35; RPL7; RPL7A; RPS3; RPL9; RPL13; RPS7; RPL4; RPS4X; RPL10A; RPL39; RPL36A; RPL28; RPL19; RPS13; RPS4Y1; RPS6; RPLP1; RPS11; RPL13A; RPS8; RPS27A; RPL26; RPL15; RPS17; RPS26; RPL23A; RPS18; RPL17; RPS20; RPL31; RPS5; RPLP0; RPL3; RPS12; RPL24; RPL5; RPS10; RPL36; RPL27; RPS24; RPS2; RPL11; RPL10; FAU; RPL30; RPS9; RPL38; RPL35A; RPS23; RPL37A; RPS29; RPL41
Disorder of lipid metabolism,NDUFAB1; NPC1L1; NDUFS1; NDUFB4; PTGS2; FDFT1; NDUFB7; HMGCR; HSD11B1; NDUFB3; NDUFA8; NDUFA5; NDUFA10; PPARG; NDUFB5; NDUFAF1; NDUFB10; GPR119; NDUFV3; NDUFAF2; NDUFS4; NDUFB8; NDUFV1; PTGDR; NDUFS5; NDUFA3; NDUFA11; NDUFV2; NDUFB1; NDUFA12; NDUFA13; PPARA; MT-ND2; MT-ND4; MT-ND1; MT-ND4L; NDUFS3; CETP; NDUFB2; NDUFC1; NDUFS8; VDR; PPARD; MAPK14; GPD2; NDUFS7; NDUFA1; THRA; NDUFS6; NDUFB9; THRB; NDUFC2; NDUFS2; PCSK9; NDUFAF3; NDUFA6; MAPK11; NDUFA4L2; NDUFA4; MT-ND6; NDUFA7; PTGS1; CNR1; NDUFAF4; SLC10A2; NDUFA9; AGTR1; NDUFB11; NDUFB6; MT-ND3; ACLY; NDUFA2; MT-ND5
Down syndrome,ACHE; GABRG2; GRIN2C; JAK1; GRIN1; GABRG3; GRIN2A; GRIN3A; JAK2; TYK2; GABRA2; GABRG1; GABRA5; GABRA3; GRIN2D; JAK3; GRIN3B; THRB; GRIN2B; GABRA1; THRA; CSF2RA
Duchenne muscular dystrophy,RPS20; ADRB1; RPL31; NFKB2; RPL6; RPLP0; RPL3; RPS16; RPS19; RPL28; RPS13; RPS12; RPL24; RPS15; RPS25; RPL5; RPL23; RPS4Y1; RPS15A; RPS6; RPS24; MSTN; RPL13A; RPS27A; RPL37; RPL10; RPS3; UTRN; RPL30; RPL26; RPL29; RPL27A; RPSA; ADRA1B; RPS9; RPS7; RPL38; RELA; RPL15; RPL37A; RPL23A; RPL10A; RPS29; RPS18; RPL36A; RPL18; RPL18A; NFKB1; RPL22; CCN2; RPL21; RPS10; RPL36; RPL27; RPL35; RPLP1; RPS2; RPS11; RPL11; RPS3A; RPL7; RPL7A; FAU; ACE; RPL8; RPL13; ADRB2; RPS27; RPL35A; RPS23; RPL14; RPS26; RPL12; RPS4X; DMD; RPL41; RPS28; RPL17; RPL19; RPL34; NR3C1; PDE5A; RPL9; RPS14; RPS21; ADRA1D; RPL4; RPS17; RPL39; RPS5; ESR1; ADRA1A; RPS8; RPL32; NR3C2; ADRB3; HRH1
Dupuytren Contracture,COL11A1; COL4A4; COL4A2; COL6A2; COL6A3; COL1A2; COL3A1; COL6A5; COL18A1; COL4A5; COL27A1; COL4A6; COL5A2; COL6A6; COL28A1; COL5A3; COL1A1; COL5A1; COL6A1; COL4A1; COL11A2; COL15A1; TNF; COL4A3; COL24A1; SCN4A; NR3C1; COL2A1
Dysmenorrhea,SCN4A; PTGS2; PGR; PDE4C; OPRM1; FAAH; NR3C2; SCN3A; CHRM1; SCN9A; SCN8A; ESR1; PTGS1; ADORA2A; SCN7A; ADORA1; ADORA2B; PDE4A; SCN11A; PDE4B; SCN10A; TRPV1; ADORA3; ALOX5; PDE4D; SCN2A; SCN1A; SCN5A
Dyspnea,ADRA1A; ADRA2A; ADORA1; ADRA1B; ADRA1D; nan; NPR1; ADRA2C; GUCY1B1; ADRA2B; NR3C1; AVPR2; ADORA2A; ADORA2B; ADORA3
Eczema,PDE4A; JAK3; VDR; PDE4D; RARA; JAK1; IL13; RARG; RXRA; HRH1; RXRB; RARB; IL4R; JAK2; TYK2; PDE4C; OPRM1; NR3C1; TNFSF4; MMP8; MMP7; RXRG; PDE4B; PPIA; MMP1; PPAT; FKBP1A; MMP13
Ehlers-Danlos syndrome,ADRB1; SCN1A; SCN9A; SCN8A; ADRA2B; SCN4A; SCN11A; SCN5A; ADRA2A; SCN3A; ADRA2C; SCN2A; SCN7A; PRKCB; ADRB2; SCN10A
Encephalopathy,GABRE; GABRA6; GABRG3; GABRD; GABRQ; GABRA1; GABRG2; ADORA3; GABRA3; GABRA2; GABRG1; GABRB1; GABRB3; GABRA5; GABRP; GABRA4; ADORA2A; GABRB2; ADORA1; ADORA2B; EPOR
