disease_name,gene_name
anaphylaxis,BTK; ADRB1; ADRA2A; ADRA2B; ADRA2C; ADRB3; ADRA1A; ADRB2; ADRA1D; ADRA1B
anaplastic astrocytoma,FGFR1; ITGB5; TGFB2; GSR; PDGFRB; EPHA4; GRIA2; PARP2; EPHB2; PDGFRA; TUBB2A; TUBB2B; ERBB2; EPHB1; HDAC3; TUBB6; ERBB4; TUBB3; FLT4; TUBB1; VEGFA; ODC1; HDAC1; PGF; PPAT; EPHA1; KIT; HDAC2; TLR7; TUBB8; EPHA3; FGFR3; EPHA8; HDAC6; FLT1; MET; EPHB6; TEK; ITGAV; EPHA5; EGFR; GRIA1; FGFR4; RET; EPHB3; TUBB; EPHB4; SRC; TOP1; PARP3; ERBB3; FGFR2; TOP2B; EPHA6; PTK6; TLR8; TUBB4A; FLT3; KDR; TOP2A; EPHA7; EPHA2; PARP1; CSF1R; EPHA10; TUBB4B; ITGB3
anaplastic ependymoma,TUBB1; PSMB2; TUBB6; PSMB10; PSMB1; PSMA7; VEGFA; PSMA1; PSMB7; TUBB2A; TUBB2B; PSMB6; PSMB8; PSMA3; PSMA6; TUBB4A; TOP2A; TUBB4B; PSMB9; PSMB3; PSMA4; TOP2B; PSMB5; PSMA2; CSF3R; PSMA5; PSMA8; PSMB4; TUBB; PSMB11; TUBB3; TUBB8
anaplastic large cell lymphoma,TOP2B; POLD3; HDAC10; TUBB1; TUBB4A; MET; HDAC5; NR3C1; PDGFRB; CSF3R; TNFRSF8; FLT3; TUBB2A; PRIM2; HDAC8; POLE3; MS4A1; HDAC11; TUBB6; IMPDH2; NPM1; RXRA; TUBB4B; RXRB; DHFR; TUBB3; POLA2; HDAC9; POLD1; HDAC6; KDR; RRM1; POLD4; TUBB; FLT4; HDAC4; HSP90AA1; FKBP1A; POLE2; HDAC1; RAF1; TUBB2B; RXRG; EGFR; ALK; HDAC3; BCL2; PDCD1; HDAC2; PRIM1; TUBB8; HDAC7; HSP90AB1; POLA1; FLT1; IMPDH1; POLD2; TOP2A; EML4; KIT; BRAF; RET; POLE
anaplastic oligoastrocytoma,FGFR2; FGFR1; PDGFRB; ITGB3; FLT1; FLT4; FGFR3; ITGB5; GSR; KDR; PDGFRA; ITGAV; FGFR4
anaplastic oligodendroglioma,ERBB3; FGFR2; FGFR1; PTK6; VEGFA; PGF; TEK; GRIA2; PPAT; EPHB2; EPHA1; ERBB4; EPHB4; EPHA6; EPHB6; EPHA4; EPHA7; ITGAV; FGFR4; EPHB3; ITGB3; FLT4; FGFR3; ITGB5; GSR; FLT3; KDR; PDGFRA; ERBB2; EPHA5; EPHB1; KIT; RET; EPHA3; EPHA8; FLT1; PDGFRB; EPHA2; EGFR; GRIA1; EPHA10; SRC; TOP1
androgenetic alopecia,SRD5A1; NR3C2; ABCC9; SRD5A2; ALDH5A1; SRD5A3; SNAP25; AR; HRH1; PTGFR
anemia,CRBN; DNMT3A; DDB1; ADA; GRIN3A; TGFB2; RBX1; GRIN1; GRIN2A; RARB; NR3C1; GRIN3B; CUL4A; RARG; FKBP1A; TGFB1; GRIN2D; TGFB3; DNMT1; RARA; GRIN2C; EPOR; GRIN2B
anemia (phenotype),NOS2; PTGS2; POLD3; TGFB2; PTGS1; POLE2; TGFB1; VDR; TGFB3; CUL4A; PKLR; POLE3; RRM1; POLE; EPOR; PRIM1; TUBB8; EGLN2; GUCY1B1; POLD1; JAK2; RBX1; CRBN; nan; EGLN3; EGLN1; TUBB2A; TUBB2B; IFNAR1; IFNAR2; JAK1; TUBB; POLA2; POLA1; INHBA; CHRM3; DDB1; TUBB3; NOS1; TUBB1; TUBB4A; IMPDH1; POLD2; NR3C1; CSF3R; PLG; PRIM2; NOS3; POLD4; TUBB6; P4HTM; TUBB4B
aneurysm,GABRG2; MMP7; GLRA1; P2RY12; KCNK9; KCNK3; KCNK18; KCNK10; GABRB1; GABRG3; GABRD; GABRQ; GABRA3; PTGS2; KCNK2; GABRP; PTGS1; GABRE; MMP8; GABRB2; GABRG1; GABRB3; MMP1; GABRA1; GABRA4; MMP13; GABRA6; GABRA2; GABRA5
angina pectoris,SCN4A; GUCY1B1; PTGS2; OPRK1; PTGS1; CACNA1F; PDE10A; PDE1A; OPRD1; ADRA1A; PLG; PDE5A; AGTR1; CACNA1C; CACNA1D; PDE9A; ADORA1; P2RY12; SCN5A; PDE6G; TRPV1; ADRB1; CALCRL; PDE4A; PDE8A; PDE6C; PDE4C; HMGCR; PDE6A; HCN4; PDE6H; DRD2; PDE3B; PDE1C; PDE6D; XDH; HTR3A; ADRA1B; PDE7A; ITGB3; SLC12A3; CACNA1S; FKBP1A; SLC29A1; PDE4D; nan; HTR4; AR; ADORA2B; PDE7B; PDE3A; PDE2A; ADRB3; OPRM1; PDE8B; SERPINC1; PDE1B; ADORA2A; PDE6B; ADRB2; ADRA1D; PDE4B; ADORA3
angioedema,IL4R; F11; NR3C1; ADRA2A; KLKB1; IGHE; ADRB1; ADRA1A; F12; BDKRB2; ADRA1B; C1S; ADRA2C; HRH1; ADRB2; ADRA1D; ADRB3; ADRA2B
angioimmunoblastic T-cell lymphoma,HDAC7; POLD1; HDAC4; POLD3; HDAC6; HDAC10; POLE2; POLA1; TUBB4A; NR3C1; DNMT3A; RRM1; CD52; POLD4; TUBB6; IMPDH2; PDCD1; PRIM1; DHFR; TUBB8; FKBP1A; TUBB1; IMPDH1; HDAC5; TUBB2A; PRIM2; POLA2; HDAC9; POLD2; HDAC1; DNMT1; HDAC8; POLE3; HDAC11; POLE; TUBB4B; HDAC2; TOP2A; TUBB2B; MS4A1; HDAC3; TUBB; TUBB3
angiosarcoma,NDUFAB1; FLT4; NDUFB4; FGFR3; NDUFB2; ESR1; ABL1; MET; ITK; PDGFRB; FLT3; NDUFAF4; KDR; NDUFA10; RAF1; NDUFB5; TUBB2B; CYP19A1; NDUFA9; PARP1; EGFR; KIT; BRAF; CTLA4; RET; TUBA1A; NDUFA3; NDUFAF3; CSF1R; TACSTD2; NDUFA12; MAPK11; NDUFA4L2; NDUFA13; MT-ND6; MT-ND4; TUBB8; PARP3; FGFR1; NDUFB7; TUBB1; FLT1; TUBB4A; ENG; VEGFA; GPD2; NDUFA1; NDUFA5; PARP2; PDGFRA; CDK4; ESR2; SLC39A6; ERBB2; NDUFS6; TUBA3E; NDUFS2; DDR2; NDUFB8; ADRB2; TUBB6; TUBB4B; NDUFA4; MT-ND5; NDUFS3; NDUFS1; ADRB1; ERBB3; FGFR2; HSP90AA1; ANGPT2; CDK6; NDUFC1; NDUFS7; TUBA1B; TUBA4A; NDUFA2; TOP2A; TUBB2A; NDUFAF1; IGF1R; EPHA2; NDUFB11; NDUFC2; NDUFB6; NDUFA11; ERBB4; LCK; NDUFB1; TUBB; MT-ND2; MT-ND3; MT-ND1; TUBB3; ABCB1; LAG3; HSP90AB1; NDUFS8; FRK; NDUFB3; NDUFA8; TEK; CD274; NDUFB10; NDUFB9; ANGPT1; NDUFV3; NDUFAF2; NDUFS4; TUBA1C; NDUFV1; NDUFS5; NDUFV2; NDUFA6; PDCD1; TUBA3C; NTRK1; TOP1; MT-ND4L; NDUFA7
aniridia,RPS20; RPLP0; RPL18A; RPS12; RPS25; RPS10; RPL23; RPS6; RPLP1; RPL13A; RPS8; RPL7; RPL7A; RPL30; RPS9; RPS21; RPL4; RPS27; RPS17; RPL35A; RPL37A; RPL12; RPS4X; RPL39; RPL41; RPS28; RPL36A; RPL17; RPL19; RPL22; RPL5; RPS4Y1; RPL27; RPS2; RPS11; RPL37; RPS3; RPL29; RPL38; RPS29; RPL31; RPS5; RPL3; RPS16; RPL28; RPL21; RPL36; RPS15A; RPS24; RPL11; RPS27A; RPL32; RPS3A; RPL26; RPL9; RPL13; RPSA; RPS23; RPS26; RPL10A; RPS18; RPL18; RPL6; RPS19; RPL34; RPS13; RPL24; RPS15; RPL35; RPL10; FAU; RPL8; RPS14; RPL27A; RPS7; RPL15; RPL14; RPL23A
ankle fracture,SCN11A; SCN5A; SCN8A; SCN4A; SCN1A; SCN9A; SCN2A; SCN7A; SCN3A; SCN10A
ankylosing spondylitis,PTGER3; PDE4A; JAK2; RBX1; TYK2; MAPK14; IL17F; NR3C1; CRBN; CD86; PPARG; SCN1A; JAK1; IL17RA; PDE4B; TNF; SCN4A; ALOX5; PTGS2; PTGS1; JAK3; PDE4C; PDE4D; CD80; CUL4A; CSF2; DDB1; SCN9A; SCN5A; TLR7; IL17A; IL12B; SCN2A; SCN3A; MS4A1; IL6R; FDPS; DHFR; ATP4A; IL23A; OPRM1; SCN7A; SCN11A; SCN10A; SCN8A; TLR9
anorexia nervosa,HTR2A; SLC6A4; ESR2; HTR2C; DRD2; DRD4; ESR1; CNR1; TNFSF11; ADRA2A; AR; ADRA2C; PGR; DRD3; FDPS; HTR1A; ADRA2B
anterior ischemic optic neuropathy,KCNG1; KCNH2; KCNQ2; KCND1; KCNS1; KCNA10; KCNA6; DRD3; EDNRA; KCNS2; KCNB1; PTGER1; KCNF1; KCNC2; KCNG4; KCNS3; KCNH7; KCNA7; KCNA1; KCNC1; KCNC3; DDC; KCNH1; KCNG3; KCNH6; KCNB2; KCNQ5; EPOR; KCNQ1; NR3C1; KCNQ4; EDNRB; KCNV1; KCND3; KCNA2; KCNA4; KCNH8; KCNQ3; KCNH4; VEGFA; KCNC4; PTGER2; KCNA5; KCNH3; KCNH5; KCNV2; KCNA3; KCNG2; KCND2
anti-neutrophil antibody associated vasculitis,PPAT; RARA; MS4A1; IMPDH1; CD86; RARG; C5AR1; HMGCR; CD80; IMPDH2; RARB; C5; NR3C1
anus disease,CACNA1S; CACNA1F; SCN10A; GUCY1B1; SCN7A; SCN2A; CACNA1D; SCN11A; SCN9A; SCN8A; SCN4A; nan; SCN1A; CACNA1C; SCN3A; SCN5A
anxiety,CACNG3; CACNA1G; GABRA3; POLA2; GABRA1; ADRB1; CACNB1; DRD4; CACNG4; GSK3B; ACHE; CACNA1I; GABRE; HTR2A; SLC6A2; SLC6A4; GABRA4; GABRG2; IMPA1; HTR2B; SCN1A; DRD2; HTR3B; CACNA1C; DRD3; GABRA2; SCN3A; GRIA1; CACNA1D; SV2A; HTR3A; CHRM1; ADRB2; GRIK1; GRIN1; HTR3C; HTR1A; ADRA2C; SCN10A; HTR3E; ADRA2B; SCN4A; PTGS2; OPRK1; GABRP; TSPO; CA2; CACNG1; OPRM1; BCHE; CNR1; GRIA2; SNAP25; SCN2A; SCN7A; CACNA1A; SLC6A3; CACNG8; GABRA6; CACNA1B; HTR7; ADRA2A; CACNA2D1; SLC6A1; HTR6; GABRG1; GABRB1; GABRB3; CA4; HTR1E; DRD5; ADRA1D; POLE; OXTR; GABRG3; CACNB4; GRIN2A; SCN5A; GABRA5; ADRB3; MAOA; SCN8A; AVPR1B; PRIM1; CACNA1E; GRIN3A; GABRQ; CACNA2D2; TACR2; CACNG5; POLD3; CACNA1S; PTGS1; POLE2; CACNA1F; GRIN2D; CACNG7; GRIK5; GRIN3B; FAAH; ADRA1A; MTNR1B; GABRB2; HTR2C; POLE3; CACNA2D4; CACNA2D3; GRIN2C; CACNB2; CACNG2; CACNB3; SCN11A; MTNR1A; SCN9A; POLD4; HTR1D; DRD1; GABRD; CACNA1H; HRH1; POLD1; MAOB; POLA1; GSK3A; POLD2; ALDH5A1; GRIA3; CACNG6; HTR1B; PRIM2; GRIK4; GRIA4; HTR5A; GRIK3; HTR4; GRIK2; RRM1; ADRA1B; HTR1F; HTR3D; TRPV1; GRIN2B
anxiety disorder,GABRA1; DRD4; GABRB2; HTR2C; GABRG1; HTR1A; GABRA6; DRD2; HRH1; GABRA3; HTR2A; SLC6A4; GABRA2; GABRB1; GABRG3; SLC6A2; GABRA4; GABRG2; DRD3; GABRB3; GABRA5
aortic stenosis,ADRB1; GABRP; KCNK10; HMGCR; GABRG2; nan; AGTR1; GABRA2; GUCY1A2; P2RY12; KCNK9; KCNK3; NPC1L1; PTGS1; SLC5A2; GABRA6; NR3C2; ACE; GABRG1; GABRB3; KCNK18; GABRA1; KCNK2; GABRE; GABRA4; OPRM1; SERPINC1; F10; PDE5A; GABRB2; GUCY1A1; F2; GABRG3; LPA; GABRA3; GUCY1B1; PTGS2; TNFSF11; GLRA1; FDPS; GABRB1; VKORC1; GABRA5; GABRD; GABRQ
aphthous ulcer,PTGS1; TUBB4A; TUBB6; HRH1; TUBB3; PTGS2; TUBB1; NR3C1; TUBB2A; TUBB2B; TUBB4B; TUBB; TUBB8
appendicitis,ACHE; OPRM1; CSF3R; ADRA1A; CHRM3; SCN1A; ADRA1D; SCN5A; ADRA2C; SCN10A; ADRA2B; SCN4A; SCN2A; SCN7A; ADRA2A; SCN3A; SCN11A; CHRM1; SCN9A; ADRB3; SCN8A; ADRB1; NR3C1; ADRB2; ADRA1B
arthritis,TRPV1; PTGS2; PTGS1; TRPA1; SCN2A; SCN9A; SCN5A; FAAH; SCN3A; SCN8A; DHFR; TNF; SCN4A; NR3C1; SCN7A; SCN1A; TRPM8; SCN11A; SCN10A
aseptic meningitis,POLA2; POLE3; POLD1; POLA1; POLD2; PRIM2; POLD4; POLE; POLD3; POLE2; PRIM1
asthma,ALOX5; ADRB1; FGFR2; FGFR3; IL4R; IL5RA; ABL1; TUBB1; ATP4A; VDR; MAPK14; IL17A; PDE4D; IL5; NR3C1; PDGFRB; TNFSF14; S1PR4; ADORA2A; ALOX5AP; SCN2A; SCN7A; IL33; TSLP; ADRA2A; PDE3B; CXCR1; ADORA1; CSF2; ADRB2; ADORA2B; S1PR1; CYSLTR1; CHRNA7; TUBB6; CHRM2; PTGDR2; GRIN2A; SCN5A; ADRA2C; PDE4B; BCR; HRH1; SCN8A; IGHE; DHFR; ADORA3; GUCY1B1; PDE4A; PTGS2; CHRNA3; FKBP1A; PTGS1; PDE4C; IL23A; GLP1R; ALDH5A1; CHRNB4; ADRA1A; nan; PPARG; CHRM3; PDGFRA; TUBB2A; TRPM8; IL9; KIT; IFNAR2; CHRNB2; SCN11A; IL13; PIK3CD; ADRA1D; CXCR2; TUBB4B; ADRB3; S1PR3; LTB4R; ADRA2B; TBXA2R; SLC6A2; HMGCR; IL4; IL1RL1; TNFSF4; HRH4; TUBB2B; SIGMAR1; EDNRA; CACNA2D1; CHRM1; P2RY12; SCN9A; ADRA1B; PDE3A; IL17RA; SCN10A; TUBB; ADH5; SCN4A; BTK; CHRNA4; TRPA1; KCNN4; TUBB4A; PIK3CG; P2RX3; IL2RA; EDNRB; IL6; IFNAR1; SCN1A; SCN3A; FDPS; SYK; PTGDR; NPR1; S1PR5; IL1RAP; TLR7; TNF; TUBB3; TUBB8; S1PR2
astrocytoma,FKBP1A; MAP2K2; TUBB6; TUBB8; GSR; TUBB4A; TUBB2A; TUBB4B; KDR; PDCD1; TUBB; TUBB3; TUBB1; MET; VEGFA; PLG; TUBB2B; MAP2K1
atherosclerosis,NDUFAB1; NPC1L1; SLC12A3; SLC12A1; TUBB4A; MAPK14; HMGCR; NDUFA2; NDUFA9; NDUFB11; NR3C2; ACE; SLC18A2; NDUFV1; NDUFS5; PCSK9; ADRB2; NDUFA3; NDUFA11; TUBB; PTGS2; NDUFB2; PTGS1; NDUFS8; CNR1; ADRA1A; CCR2; ADORA2A; PPARG; REN; AGTR1; PLA2G7; CACNA1C; NDUFC2; NDUFS2; NDUFAF2; VKORC1; P2RY12; INSR; NDUFB1; NDUFA12; NDUFA4L2; PPARA; TUBB4B; ADRB3; MT-ND6; MT-ND2; MT-ND3; AMY2A; MGAM; TUBB3; ADRB1; SOAT1; ESR1; NDUFB7; TUBB1; CACNA1F; SCNN1A; NDUFS7; NDUFA1; IL1B; F10; NDUFA5; NDUFB5; TUBB2B; NDUFB10; NDUFB9; CACNA1D; NDUFV3; NDUFB6; SOAT2; ADRA1B; ADORA2B; TUBB6; MAPK11; NDUFA13; KCNJ11; NDUFA4; MT-ND5; MT-ND4; MT-ND4L; NDUFA7; ADORA3; ABCC8; ALOX5; NDUFS1; NDUFB4; CACNA1S; NDUFC1; GPD2; NDUFB3; NDUFA8; NDUFAF4; NDUFA10; ACLY; TUBB2A; NDUFAF1; NDUFS6; ADORA1; NDUFS4; NDUFB8; ADRA1D; PDE3A; NDUFAF3; NDUFV2; NDUFA6; MT-ND1; NDUFS3; TUBB8
atopic asthma,IL4R; NR3C1; CD86; PTGDR2; CD80; TSLP; ADRB2; CYSLTR1; KCNN4; TLR7
atopic eczema,ITGAL; IL4R; JAK2; TYK2; JAK3; PDE4C; IMPDH1; VDR; PDE4D; NR3C1; IL1A; IL1RL2; OPRD1; MMP8; IL22; MMP13; TSLP; JAK1; IL31RA; MTNR1A; IL13; CYSLTR1; IMPDH2; CNR2; PPIA; TRPV1; NTRK1; IGHE; BTK; PDE4A; RARB; AHR; IL5; HRH2; TACR1; RARA; SYK; PDE4B; RXRA; HRH1; NR1H3; OPRK1; FKBP1A; SIGLEC8; IL17A; IL12B; CD2; TNFSF4; HRH4; IL33; INPP5D; RARG; TNFRSF4; IL1RAP; RXRB; DHFR; IL5RA; SLC6A2; OPRM1; IL1RL1; NR1H2; CHRM3; MTNR1B; MMP7; RXRG; S1PR1; PTGDR2; MMP1
atrial fibrillation,GABRA1; ADRB1; KCNH2; NDUFB4; PTGS2; F11; NDUFB7; GABRE; KCNA7; GABRG2; GPD2; KCNQ4; NDUFA8; NDUFAF4; KCNS1; IL1B; ADORA2A; NDUFA5; KCNA5; NDUFA10; NDUFA2; SNAP25; ATP1A4; SCN7A; HCN4; SLC5A2; KCNA10; AGTR1; NDUFB9; ADRA2A; CACNA1C; KCNA6; NDUFC2; NR3C2; GABRA2; CACNA1D; KCNB1; NDUFV3; GABRB1; ATP1A1; NDUFS4; KCNC2; VKORC1; SCN11A; ADRB2; SCN9A; ADRA1B; ADORA2B; NDUFA3; KCND3; F2; KCNA4; SCN5A; ADRA2C; KCNH7; NDUFA6; NDUFA4L2; TUBB4B; ADRB3; MT-ND6; MT-ND2; MT-ND1; MT-ND4L; NDUFS3; TUBB3; NDUFA7; ADRA2B; NDUFAB1; SCN4A; KCNQ1; CACNA1S; PTGS1; CACNA1F; KCND1; TUBB4A; ATP1A3; HMGCR; NR3C1; NDUFS7; SERPINC1; NDUFB3; ADRA1A; KCNJ2; KCNC1; NDUFB5; SCN2A; TUBB2A; TUBB2B; NDUFA9; NDUFB10; KCNH1; NDUFS6; SCN3A; KCNS2; NDUFS2; ADORA1; NDUFV1; KCNV2; MTNR1A; NDUFS5; P2RY12; KCNS3; KCNG3; ADRA1D; NDUFA11; KCNA3; KCNA2; NDUFAF3; NDUFV2; GABRG3; KCNH8; SCN10A; SCN8A; MT-ND5; TUBB8; GABRQ; ADORA3; GABRA3; ATP1A2; NDUFS1; NDUFB2; GABRP; TUBB1; NDUFC1; NDUFS8; GLP1R; KCNC4; KCNJ5; NDUFA1; KCNC3; MTNR1B; KCNH3; KCNH5; REN; SCN1A; GABRA6; ACE; KCNF1; KCNJ3; GABRG1; NDUFAF2; HTR4; NDUFB6; NDUFB8; TUBB6; NDUFB1; KCND2; NDUFA12; NDUFA13; GABRA5; GABRD; TUBB; HRH1; MT-ND4; VAMP2; NISCH; KCNG1; KCNQ2; KCNH4; ATP4A; GABRA4; KCNA1; F10; NDUFAF1; GABRB2; NDUFB11; KCNV1; GABRB3; HTR3A; KCNG4; KCNH6; KCNG2; KCNB2; KCNQ3; KCNQ5; NDUFA4; MT-ND3
atrial flutter,CACNA1S; KCNC4; F10; SCN7A; SCN1A; KCNS2; KCNC2; SCN11A; KCND3; KCNG2; SCN5A; KCNH7; KCNG1; KCNH2; CACNA1F; KCND1; KCNA7; KCNJ5; KCNA5; KCNH3; KCNA10; KCNH1; CACNA1C; CACNA1D; KCNJ3; KCNV1; KCNV2; KCNA3; KCNA2; KCNB2; KCNQ3; KCND2; ADRB1; KCNQ1; KCNQ2; KCNH4; KCNQ4; KCNC1; SNAP25; KCNH5; KCNA6; KCNF1; KCNG4; F2; KCNA4; SCN10A; SCN4A; KCNA1; KCNJ2; KCNS1; KCNC3; SCN2A; HCN4; SCN3A; KCNB1; ACE; VKORC1; SCN9A; KCNS3; KCNG3; KCNH6; KCNH8; KCNQ5; SCN8A
atrophic macular degeneration,SCN4A; NDUFB4; GPD2; NDUFS7; NDUFB3; NDUFAF4; SCN2A; MMP7; APP; NDUFB9; NDUFC2; SCN9A; SCN5A; NDUFA4; MT-ND2; MT-ND4; NDUFS3; ADRA2B; FKBP1A; NDUFC1; MMP8; NDUFA5; NDUFA2; MMP13; SCN1A; NDUFS6; NDUFB11; NDUFS2; NDUFV1; SCN11A; NDUFAF3; NDUFV2; ADRA2C; NDUFA12; NDUFA4L2; MMP1; CFD; MT-ND1; NDUFA7; NDUFS1; NDUFB2; C5; NDUFS8; NDUFA8; NDUFA1; C3; NDUFB5; SCN7A; NDUFA9; SCN3A; NDUFV3; NDUFAF2; NDUFS4; NDUFB6; NDUFA3; SCN10A; NDUFA13; SCN8A; MT-ND5; MT-ND3; MT-ND4L; NDUFAB1; NDUFB7; NR3C1; RPE65; NDUFA10; NDUFAF1; NDUFB10; ADRA2A; NDUFB8; NDUFS5; NDUFA11; NDUFB1; NDUFA6; MT-ND6
attention deficit hyperactivity disorder,ADRB1; OPRK1; HTR2A; SLC6A2; SLC6A4; VDR; DDC; SLC6A3; HTR2C; DRD2; GRIN2C; GABRB1; ADORA1; ADRA1B; ADRA2C; ADRB3; GRIN2B; ADRA2B; ACHE; GHR; GRIN3B; OPRD1; ADRA1A; MTNR1B; CHRNA6; ADRA2A; GRIA1; SLC18A2; ADRB2; ADORA2B; CHRNA7; GRIN1; ADORA3; HRH3; CHRNA4; GRIN2D; GRIA2; DRD3; HTR3A; HTR1A; GRIN2A; OPRM1; ALDH5A1; GABRG2; GRIA3; ADORA2A; GRIA4; CHRNB2; MTNR1A; CHRNA5; ADRA1D; GRIN3A
atypical teratoid rhabdoid tumor,TOP2B; AURKA; TUBB2B; TUBB3; TUBB4A; TUBB4B; DHFR; TUBB1; TUBB6; TOP1MT; TUBB8; TOP2A; TUBB2A; TUBB
autism,SCN4A; GABRA1; SCTR; SLC6A2; GRIN2D; ALDH5A1; CRBN; GRIN3B; AVPR2; HCRTR2; DRD2; ADRA2A; DRD3; GABRB3; DDB1; MTNR1A; GRIN1; HTR1A; GABRG3; GABRA5; GABRD; HRH1; SCN8A; AVPR1B; SLC12A1; ACHE; RBX1; SLC6A4; GABRG2; HCRTR1; MTNR1B; SCN7A; SCN1A; GABRA6; GABRB2; SIGMAR1; GABRA2; GRIN2C; SCN11A; SCN9A; SCN5A; ADRA2C; SCN10A; HTR2A; SCN2A; HTR2C; GABRB1; GRIN2B; GABRA3; DRD4; GABRP; GABRE; ATP4A; GABRA4; VDR; CNR1; CUL4A; SCN3A; GABRG1; AVPR1A; PAH; OXTR; GRIN2A; GRIN3A; GABRQ; ADRA2B
autism spectrum disorder,GABRA1; SLC12A1; HTR2A; GABRA4; GRIN3B; PPARG; GABBR2; SCN1A; GABRA6; GABRB2; ADRA2A; DRD3; GRIN2C; GABRB1; AVPR1A; SCN9A; GRIN1; HTR1A; GABRG3; GRIN2A; SCN5A; ADRA2C; GABRA5; GABRD; SCN8A; GABBR1; GRIN2B; ADRA2B; GABRA3; GSK3B; ACHE; GABRE; GRIN2D; GSK3A; FAAH; AVPR2; MTNR1B; DRD2; GABRG1; SCN11A; OXTR; NQO1; GRIN3A; SCN4A; SLC6A4; CNR1; SCN2A; SCN7A; HTR2C; SIGMAR1; SCN3A; CACNA2D1; MTNR1A; SCN10A; AVPR1B; GABRQ; GABRP; GABRG2; IMPA1; GABRA2; GABRB3
autoimmune thrombocytopenic purpura,CD38; BTK; PTGS2; PGR; JAK2; RBX1; PSMB5; FCGRT; MPL; DNMT3A; TUBB2A; TUBB2B; TNFRSF13C; SYK; RARG; TUBB6; TUBB8; TRAF3IP2; FKBP1A; TUBB1; TUBB4A; IMPDH1; VDR; NR3C1; MS4A1; TUBB4B; PPIA; TLR7; MIF; RARB; TNFSF13B; CRBN; PPAT; DNMT1; RARA; CUL4A; AR; ADRB2; IMPDH2; TLR9; HMGCR; TOP2A; JAK1; DDB1; CD52; RHD; TUBB; TUBB3
autosomal dominant cerebellar ataxia type II,SCN3A; SCN11A; SCN2A; SCN7A; SCN1A; SCN4A; SCN9A; SCN5A; SCN10A; SCN8A
avascular necrosis,PTGS2; KCNK2; KCNK10; GABRE; PDE6A; GABRA6; SCN3A; CACNA2D1; PDE6D; SCN11A; KCNK9; SCN9A; CHRNB1; SCN5A; SCN10A; PDE2A; TRPV1; SCN8A; SCN4A; GABRP; CHRNE; HMGCR; FAAH; ADORA2A; CHRND; SCN2A; PDE5A; PDE1C; PDE7B; GABRG3; GABRD; PDE7A; GABRA3; GABRA1; PDE4A; PDE8A; PDE4C; PDE10A; PDE8B; SCN7A; CHRNA1; PDE6H; GABRB2; GABRG1; ADORA2B; KCNK3; PDE3A; PDE4B; PDE6G; GABRA5; CHRNG; PTGS1; PDE6C; GABRA4; GABRG2; PDE4D; PDE1A; PDE1B; PDE6B; SCN1A; GLRA1; GABRA2; PDE3B; PDE9A; GABRB1; GABRB3; KCNK18; GABRQ
bacterial disease,PTGS1; DPEP1; TOP2B; MMP13; MMP8; MMP7; PTGS2; SERPINC1; TOP2A; MMP1
bacterial vaginosis,SCN4A; SCN2A; SCN11A; SCN5A; SCN10A; SCN1A; PGR; SCN7A; SCN3A; SCN9A; SCN8A; ESR1; NR3C1
bacteriemia,SCN4A; ADRB1; SCN2A; SCN7A; SCN1A; ADRA2A; SCN3A; ADRA1D; ADRB3; ADRA1A; ADRB2; SCN5A; SCN10A; ADRA2B; SERPINC1; ADRA1B; ADRA2C; SCN8A; SCN11A; SCN9A
basal cell carcinoma,PTGS1; PDCD1; TLR7; SMO; CTLA4; SRC; PTGS2; RARB; LAG3; VDR; RARA; RARG; TYMS
benign essential blepharospasm,SNAP25; SCN2A; SCN7A; CNR1; SCN9A; SCN5A; SCN4A; SCN1A; SCN3A; SCN11A; GRM5; SCN10A; SCN8A
benign muscle neoplasm,PGR; GNRHR; PTGER3; CYP19A1; ADRA2A; ADRA2C; ADRA2B; PTGER2; AVPR2; PTGER1; AVPR1A; ADRB2; ADRA1B; PTGER4; ADRB3; AVPR1B; ADRB1; ADRA1A; ADRA1D; OXTR
benign prostatic hyperplasia,PGR; ADRA1A; SNAP25; SCN2A; PDE5A; ESR2; SCN9A; ADRA1B; ADRA1D; CHRM2; TUBB4B; PTGS2; TUBB1; GNRHR; NR3C1; CHRM3; SCN7A; AR; SCN5A; TUBB; SCN8A; SCN4A; SRD5A3; TUBB2A; TUBB2B; SRD5A1; SCN3A; SCN11A; TUBB6; SCN10A; TUBB3; TUBB8; SRD5A2; TUBB4A; SCN1A
beta-thalassemia major,POLA2; JAK2; POLA1; INHBA; IL2RA; CACNA1C; JAK1; POLD3; CACNA1S; CACNA1F; DNMT3A; POLE3; RRM1; POLD4; POLE; DHFR; FKBP1A; POLE2; IMPDH1; DNMT1; CACNA1D; IMPDH2; POLD1; POLD2; PRIM2; PPIA; PRIM1
bile duct carcinoma,FGFR1; ABL1; PDGFRB; KDR; KIT; DDR2; FLT4; PDGFRA; TEK; RAF1; BRAF; RET; MAPK11; NTRK1; FGFR2; FLT1; FRK; EPHA2
biliary atresia,PDE4A; PDE8B; PDE4D; ADRA1A; SLC10A2; PDE6A; ADRA2A; PDE9A; ADRA1D; ADRB3; ADRB1; PDE10A; NR3C1; PDE1A; PDE5A; PDE3B; PDE6D; ADRA1B; PDE7B; PDE2A; PDE8A; PTGS2; PDE4C; CSF3R; PDE1C; ADRB2; ADORA2B; PDE3A; PDE7A; ADRA2B; PDE6C; PDE1B; ADORA2A; PDE6B; PDE6H; ADRA2C; PDE4B; PDE6G
biliary tract cancer,POLD1; FGFR2; POLA1; POLD2; DKK1; FRK; VEGFA; FLT3; MAP2K2; KDR; TUBB2A; TPH2; GART; RRM1; MAP2K1; TUBB6; POLE; NTRK1; DHFR; POLA2; FLT4; POLD3; POLE2; FLT1; PDGFRB; TUBB2B; EGFR; DDR2; TYMS; TUBB4B; DPYD; TUBB; TOP1; TUBB8; ABL1; TUBB1; TEK; CD274; TPH1; EPHA2; PARP1; PRIM2; POLE3; BRAF; RET; POLD4; PDCD1; PRIM1; PARP3; TOP2B; FGFR1; TUBB4A; CDK6; MET; PARP2; TOP2A; RAF1; PDGFRA; CDK4; ERBB2; KIT; CTLA4; MAPK11; TUBB3
biliary tract disease,POLA2; POLA1; POLE3; POLE; POLD1; POLD2; POLD4; POLD3; POLE2; PRIM2; RRM1; PRIM1
biliary tract neoplasm,POLA2; POLD1; FGFR2; POLE2; TUBB1; POLD2; TUBB2B; PRIM2; RRM1; MAP2K1; POLD4; TUBB6; ERBB4; PRIM1; TUBB3; TUBB8; POLD3; POLA1; FLT1; FLT3; PDGFRA; PARP1; EGFR; KIT; BRAF; POLE; TUBB; CSF2RA; FLT4; FGFR1; TUBB4A; PDGFRB; MAP2K2; RAF1; TUBB2A; IDH1; ERBB2; POLE3; FGFR4; CTLA4; RET; TYMS; TUBB4B; PDCD1; TOP1; FGFR3; CD274; KDR; PARP2
binge eating,GRIK5; GRIA2; SLC6A3; GABRA6; GABRB2; GRIA4; GRIK3; SLC18A2; CA4; SCN9A; GABRG3; GABRA3; PGR; ESR1; GABRE; GABRA4; SCN2A; SCN7A; GRIK4; GABRA2; SCN3A; GRIK2; SCN11A; GRIK1; SCN10A; GABRA5; GABRD; GABRQ; SCN4A; GABRA1; SLC6A2; GABRG2; GABRB3; GABRP; CA2; GLP1R; GRIA3; SCN1A; NR3C2; GRIA1; GABRG1; GABRB1; SCN5A; SCN8A
bipolar I disorder,ALDH5A1; GRIN3B; SCN2A; SCN1A; HTR2C; DRD2; DRD3; SCN3A; SCN11A; SCN9A; GRIN1; HTR1A; GRIN2A; SCN5A; SCN8A; HTR2A; GSK3A; SLC6A4; IMPA1; SCN7A; SCN10A; GRIN3A; GRIN2B; SCN4A; DRD4; OPRK1; GSK3B; SLC6A2; GRIN2D; OPRM1; SLC6A3; GRIN2C; OPRD1
bipolar disorder,NDUFAB1; SCN4A; NDUFS1; CACNA1S; GSK3B; NDUFB2; CACNA1F; GABRE; SLC6A2; CA2; GSK3A; GRIK5; SLC6A4; NDUFC1; SCNN1A; ALDH5A1; PDE4D; GPD2; NDUFS7; CNR1; NDUFB3; NDUFA8; GRIA2; NDUFAF4; NDUFA5; NDUFA10; IMPA1; HTR1B; SCN2A; SCN7A; NDUFAF1; NDUFA9; NDUFB10; SLC6A3; SCN1A; NDUFS6; NDUFB11; HTR2C; NDUFB9; DRD2; HTR3B; ADRA2A; CACNA1C; DRD3; GABRA2; GRIA4; GRIA1; HTR5A; HTR6; GRIK3; NDUFAF2; NDUFS4; HTR4; NDUFB6; SLC18A2; HTR3A; CA4; SCN11A; MTNR1A; GRIN1; HTR3C; NDUFV2; GABRG3; SCN5A; ADRA2C; PDE4B; NDUFA12; NDUFA4L2; NDUFA13; HTR3D; GABRA5; GABRD; SCN8A; MT-ND6; MT-ND2; MT-ND5; MT-ND3; MT-ND4; PDE7A; NDUFS3; TNF; GABRQ; GRIN2B; ADRA2B; GABRA1; NDUFB4; DRD4; PDE8A; PTGS2; PTGS1; PDE6C; NDUFB7; HTR2A; GRIN2D; NDUFS8; PPARD; GLP1R; SLC29A1; GABRG2; PDE1B; NDUFA1; THRA; NDUFB5; NDUFC2; PDE3B; SCN3A; PDE1C; PDE6D; CACNA1D; XDH; NDUFS2; PDE9A; NDUFV3; GRIN2C; GABRG1; GABRB1; NDUFB8; NDUFV1; CHRM1; HTR1E; SCN9A; NDUFA3; NDUFA11; NDUFAF3; HTR1A; GRIN2A; SCN10A; PDE6G; PPARA; NDUFA4; MAOA; GRIN3A; MT-ND1; MT-ND4L; GABRA3; MAOB; PGR; ACHE; GABRP; PDE4C; GABRA4; NR3C1; GRIN3B; GRIA3; NDUFA2; PPARG; MTNR1B; PDE5A; PDE6H; GABRA6; GABRB2; THRB; GRIK2; GABRB3; NDUFS5; INSR; HTR1F; NDUFB1; NDUFA6; HTR3E; PDE2A; PDE4A; ESR1; PDE10A; HMGCR; PDE8B; PDE1A; PDE6A; ALOX5AP; PDE6B; HTR2B; SIGMAR1; CACNA1B; HTR7; GRIK4; SV2A; GRIK1; PDE7B; PDE3A; HTR1D; NDUFA7
bladder transitional cell carcinoma,POLD3; FGFR1; POLE2; FLT1; TGFB1; EPHB6; CD274; EFNB2; TUBA4A; TUBB2B; EPHA5; EPHA1; RET; RRM1; POLD4; EPHB3; LCK; TUBB4B; PRIM1; MTOR; TUBB8; POLA2; FLT4; EPHA3; POLD1; EPHA6; TUBB1; PTK6; POLA1; POLD2; TEK; PIK3CA; KDR; TOP2A; TUBB2A; PIK3R5; PRIM2; POLE3; FGFR4; CTLA4; ATR; TYMS; ERBB4; CSF1R; PDCD1; TUBB; SRC; DHFR; ERBB3; AURKA; TGFB2; TUBB4A; PIK3R2; ITK; PDGFRB; PIK3R3; PDGFRA; ERBB2; EPHA2; TUBA3E; KIT; TUBA1A; TUBA1C; PIK3CD; TUBB6; POLE; EPHA10; TUBA3C; TUBB3; PIK3CB; FGFR2; FGFR3; EPHA8; FKBP1A; PIK3CG; EPHA4; TGFB3; TUBA1B; EPHB2; EPHA7; PIK3R1; EGFR; EPHB1; EPHB4
bladder tumor,SCN4A; POLD1; POLE2; POLA1; POLD2; TUBB2B; PRIM2; POLE3; RRM1; POLD4; POLE; PDCD1; SCN8A; PRIM1; POLA2; PARP3; FGFR2; FGFR3; FGFR1; ESR1; SCN2A; SCN7A; TUBB2A; FGFR4; SCN11A; TYMS; TUBB4B; TUBB3; POLD3; PTGS1; TUBB4A; CD274; PARP2; SCN3A; CTLA4; TUBB6; TUBB; PTGS2; TUBB1; IDO1; PARP1; SCN1A; SCN9A; SCN5A; SCN10A; TUBB8
blastic plasmacytoid dendritic cell neoplasm,TUBB1; POLD2; NR3C1; PPAT; TUBB2A; EEF2; POLD4; POLE; DHFR; TUBB8; POLD3; TUBB2B; PRIM2; TUBB6; IL3RA; POLE2; TUBB4A; MS4A1; BCL2; TUBB; PRIM1; POLA2; POLD1; POLA1; TOP2A; POLE3; TUBB4B; TUBB3
blindness (disorder),NDUFB4; NDUFB2; NDUFS7; NDUFA5; NDUFA10; NDUFAF1; NDUFA9; NDUFB9; NDUFC2; NDUFAF2; NDUFA11; NDUFAF3; NDUFB1; MT-ND1; NDUFS8; NDUFB3; NDUFA2; NDUFB5; NDUFS6; NDUFV3; NDUFS4; NDUFB6; NDUFV2; NDUFA12; NDUFA13; MT-ND5; NDUFA7; NDUFS1; NDUFB7; NDUFC1; VEGFA; GPD2; NDUFA8; NDUFB10; NDUFS2; NDUFV1; NDUFA4; MT-ND6; MT-ND2; MT-ND4L; NDUFS3; NDUFAB1; NDUFAF4; NDUFA1; NDUFB11; NDUFB8; NDUFS5; NDUFA3; NDUFA6; NDUFA4L2; MT-ND3; MT-ND4
blood coagulation disease,PTGS2; OPRM1; SERPINC1; CHRM3; FGG; CHRM2; ADRB3; ADRB1; PLG; F10; ADRB2; FGB; SCN4A; PTGS1; VDR; ADRA1B; FGA; ADRA2C; ADRA1A; ADRA2A; CHRM1; ADRA1D; ADRA2B
body weight gain,DRD4; NDUFB2; HTR2A; NDUFC1; GLP1R; NDUFA8; NDUFA1; NDUFA10; NDUFA2; SCN2A; NDUFAF1; NDUFA9; NDUFS6; NDUFS2; NDUFV3; NDUFV1; SCN9A; NDUFV2; NDUFA12; NDUFA4L2; NDUFA13; NDUFA4; MT-ND6; MT-ND2; MT-ND4; MT-ND1; NDUFAB1; SCN4A; NDUFS1; NDUFS8; GPD2; NDUFS7; NDUFB3; NDUFAF4; SCN7A; NDUFB10; HTR2C; NDUFB9; DRD2; SCN3A; NDUFB6; NDUFB8; SCN11A; NDUFS5; NDUFAF3; NDUFA6; MT-ND3; NDUFS3; NDUFB4; NDUFA5; NDUFB5; NDUFB11; DRD3; NDUFAF2; NDUFS4; HTR1A; NDUFB1; SCN5A; HRH1; SCN8A; CALCR; NDUFB7; HRH3; SCN1A; NDUFC2; NDUFA3; NDUFA11; OXTR; SCN10A; MT-ND5; MT-ND4L; NDUFA7
bone fracture,SCN4A; GABRA1; PTGS2; ACHE; NDUFB7; VDR; NDUFS7; NDUFA8; TNFSF11; IMPA1; SCN7A; ESR2; NDUFB10; SCN1A; GABRA6; GABRB2; NDUFB11; NDUFB9; HTR3B; NDUFC2; FDPS; NDUFAF2; SCN11A; SCN9A; NDUFA3; GRIN1; NDUFB1; GABRD; NDUFA4; HRH1; TRPV1; SCN8A; GRIN3A; MT-ND5; MT-ND4; NDUFS3; GRIN2B; CASR; KCNK2; ESR1; PTGS1; NDUFC1; OPRM1; GABRG2; GRIN3B; NDUFB3; PLG; NDUFAF4; NDUFA1; GLRA1; ADRA2A; GABRA2; PTH1R; GRIN2C; GABRG1; INSR; KCNK3; NDUFAF3; HTR3C; GABRG3; GRIN2A; SCN5A; NDUFA12; SCN10A; NDUFA4L2; NDUFA13; HTR3E; HTR3D; GABRA5; MT-ND6; GABRQ; GABRA3; NDUFS1; NDUFB2; GABRP; GABRE; GRIN2D; NR3C1; GPD2; FAAH; NDUFA10; NDUFB5; SCN2A; NDUFAF1; SCN3A; CACNA2D1; NDUFS2; GABRB1; NDUFS4; NDUFB8; HTR3A; SOST; NDUFS5; KCNK9; NDUFA11; ADRA2C; KCNK18; MT-ND1; ADRA2B; NDUFAB1; CALCR; NDUFB4; GSK3B; KCNK10; GSK3A; GABRA4; NDUFS8; NDUFA5; NDUFA2; NDUFA9; NDUFS6; NDUFV3; NDUFB6; GABRB3; NDUFV1; NDUFV2; NDUFA6; MT-ND2; MT-ND3; MT-ND4L; NDUFA7
bone marrow failure syndrome,POLA2; POLD1; POLD3; POLA1; POLD2; RRM1; POLE; DHFR; FKBP1A; POLE2; PRIM2; POLE3; PRIM1; POLD4
botulism,KCNQ4; KCNA10; KCNV2; KCNA3; KCND2; KCNH2; KCNQ2; KCNH4; KCND1; KCNA7; KCNA1; KCNA5; KCNC3; KCNA6; KCNV1; KCNC2; KCNG4; KCNG3; KCND3; KCNH6; KCNA2; KCNH8; KCNQ3; KCNH7; KCNG1; KCNQ1; KCNS1; KCNH3; KCNS2; KCNB1; KCNF1; KCNS3; KCNQ5; KCNC4; KCNC1; KCNH5; KCNH1; KCNG2; KCNA4; KCNB2
brachial plexus neuropathy,PDE6C; PDE4C; PDE10A; PDE6A; PDE8B; PDE4D; ADORA2A; PDE6B; PDE4B; PDE2A; PDE4A; PDE5A; PDE6H; PDE3B; PDE1C; PDE6D; ADORA2B; PDE7A; PDE8A; PDE1A; PDE1B; PDE9A; PDE7B; PDE3A; PDE6G
brain aneurysm,GABRA3; PTGS2; GABRP; PTGS1; GABRE; GABRA4; GABRG2; GABRA6; GABRB2; GABRG1; KCNK3; GABRD; GABRA1; ADRB1; ADRA2A; GABRA2; GABRB3; ADRB2; P2RY12; KCNK9; GABRG3; ADRA2C; GABRA5; ITGB3; GABRQ; ITGA2B; KCNK2; FKBP1A; HMGCR; GABRB1; PDE3A; KCNK18; ADRA2B; KCNK10; GLRA1
brain cancer,TOP2B; GSK3B; IMPDH1; VEGFA; NR3C1; IMPA1; ERBB2; TUBB6; TOP1; DHFR; GSR; GSK3A; HTR3A; IMPDH2; ERBB4; TUBB4B; TUBB8; PTGS2; TOP2A; EGFR; TYMS; PDCD1; TUBB; TUBB3; TUBB1; TUBB4A; TUBB2A; TUBB2B
brain disease,FGR; FYN; PDGFRB; PDE1B; SRMS; PDE6B; PDE6D; PDE7B; TYMS; ADRA2C; GABRA5; HDAC2; LYN; GABRP; PDE6C; GABRG2; PDE4D; PDE1A; ADORA2A; GABRA6; EGFR; ADRA2A; PDE3B; PDE1C; KIT; GABRB1; GABRB3; ADORA2B; YES1; PDE4B; GABRQ; ADRA2B; GABRA3; GABRA1; PDE4A; PDE8A; HDAC6; ABL1; HCK; GABRA4; FRK; PDE10A; PDE8B; PDE6A; BLK; PDE5A; PDE6H; PDE9A; HDAC3; LCK; PDE6G; GABRD; PDE7A; GABRE; PDE4C; HDAC1; ERBB2; EPHA2; GABRB2; GABRA2; GABRG1; PDE3A; GABRG3; PDE2A; BCR; SRC
brain injury,GUCY1B1; DRD4; ACHE; KCNK10; SLC6A2; CHRNE; SLC6A4; OPRM1; HMGCR; IL1R1; GRIN3B; FAAH; nan; SCN7A; MMP7; ESR2; AGTR1; GABRA6; DRD2; ADRA2A; GABRB1; GABRB3; ADRB2; KCNK3; GRIN1; SCN5A; ADRA2C; SCN10A; EPOR; GABRD; ADRB3; TRPV1; GRIN3A; GABBR1; GABRQ; GRIN2B; ADRA2B; SCN4A; GABRA3; GABRA1; ADRB1; PGR; ESR1; GABRP; GRIN2D; GABRA4; GABRG2; BCHE; MMP8; PLG; CHRND; SCN2A; MMP13; SLC6A3; SCN1A; GABRA2; CACNA2D1; GABRG1; SCN9A; GABRG3; GRIN2A; GABRA5; KCNK18; MMP1; CHRNG; SCN8A; PTGS2; KCNK2; COMT; PTGS1; VEGFA; GHR; SERPINC1; ADRA1A; SNAP25; GABRB2; GLRA1; SCN3A; CHRNB1; KCNJ11; ABCC8; GABRE; GLP1R; MTNR1B; GABBR2; CHRNA1; PDE5A; DRD3; GRIN2C; SCN11A; MTNR1A; CHRM1; AR; KCNK9; ADRA1B; ADRA1D; PPIA
