disease_name,gene_name
osteoporosis,CASR; GUCY1B1; ESR1; POLE2; ATP4A; VDR; NR3C1; ESR2; PRIM2; FDPS; PTH1R; SOST; POLE; CALCR; PGR; PTGS1; HMGCR; FAAH; TNFSF11; CTSK; POLA2; POLD1; PTGS2; POLD3; POLD2; CYP19A1; TRPV1; POLA1; GNRHR; nan; POLE3; POLD4; PRIM1
osteoradionecrosis,PDE8A; PDE3B; PDE7B; PDE4A; PDE4C; PDE4D; PDE1B; ADORA2A; PDE6H; PDE9A; ADORA2B; PDE2A; PDE10A; PDE6A; PDE5A; PDE7A; PDE6C; PDE8B; PDE1A; PDE6B; PDE1C; PDE6D; PDE3A; PDE4B; PDE6G
osteosarcoma,FLT4; FGFR3; FGFR1; POLE2; TUBB1; POLA1; MET; FRK; ITK; PDGFRB; CD274; TOP2A; TUBB2B; ERBB2; BRAF; GART; RRM1; POLE; MAPK11; TUBB4B; PDCD1; TUBB; SRC; PRIM1; MTOR; POLD1; TOP2B; POLD3; FKBP1A; ABL1; FLT1; TUBB4A; TEK; FLT3; IGF1R; IFNAR1; DDR2; RET; ATR; TYMS; TOP1; DHFR; TUBB8; POLA2; PARP3; GSK3A; POLD2; CSF3R; RAF1; IMPA1; PDGFRA; CDK4; TUBB2A; PRIM2; POLE3; IFNAR2; LCK; CSF2RA; NTRK1; FGFR2; GSK3B; CDK6; TNFSF11; KDR; PARP2; GPNMB; EPHA2; PARP1; KIT; FDPS; NOD2; POLD4; TUBB6; CSF1R; TUBB3
ovarian cancer,SCN4A; GABRA3; PRKCH; FLT4; PARP3; POLD1; SLC9A3; PRKCZ; HDAC4; ABCC9; PTGS2; POLD3; FGFR1; PTGS1; IL2RB; KCNK10; TUBB1; POLA1; FLT1; TUBB4A; PDE4C; POLD2; FOLR1; BIRC2; OPRM1; VEGFA; ITK; PDGFRB; PRKD3; EPHA4; PIK3R3; F3; SERPINC1; CSF3R; CD274; PIK3CA; PLG; PDE1B; TUBA4A; SMO; PARP2; TOP2A; PDE6A; IL2RA; PDGFRA; EPHA7; TUBB2B; PDE5A; ESR2; PDPK1; PARP1; GLRA1; PRIM2; EGFR; CHEK1; GABRA2; TUBA3E; SCN3A; BRAF; SLC34A2; CD3G; FDPS; PRKCI; GABRB3; CD3D; RRM1; TUBA1A; SCN11A; MAP2K1; SCN9A; KCNK3; CYSLTR1; ATR; POLD4; TUBB6; POLE; ERBB4; MUC16; TIGIT; CHEK2; PRKD1; TOP1MT; PDE4B; MAPK11; GABRA5; BCR; EPOR; TUBB; PPIA; TUBA3C; CD3E; TOP1; TUBB3; TUBB8; POLA2; BIRC3; IFNGR1; HDAC9; ERBB3; PDE4A; FGFR2; FGFR3; EPHA8; PDE8A; TOP2B; ESR1; HDAC6; ABL1; HDAC10; POLE2; CD40; TLR8; EPHB6; TNKS2; NR3C1; AKT3; KDR; IDO1; RAF1; TUBB2A; KIF11; CUL4A; PIK3R5; TP53; ERBB2; EPHA2; PIK3R1; GABRB2; HDAC8; POLE3; ANGPT1; KIT; XDH; IFNAR2; GART; PDE9A; FGFR4; ITGA5; GABRB1; TUBA1C; FNTA; BCL2L1; HDAC3; PDE3A; AURKB; CSF1R; SCN5A; PDE6G; PDE2A; KCNK18; TUBB4B; TLR7; SCN8A; SRC; PDE7A; FNTB; BTK; GABRA1; EPHA3; PIK3CB; PRKCQ; EPHA6; PGR; AURKA; FKBP1A; ANGPT2; PDE6C; PSMB5; GABRE; PIK3R2; HDAC5; GABRA4; FRK; ALDH5A1; SLC29A1; HMGCR; PDE8B; GABRG2; PDE4D; CRBN; PDE1A; MPL; PGF; EPCAM; TNFRSF10B; CDK2; TUBA1B; PRKCG; BCL2L2; DNMT1; EPHB2; CDK4; SCN7A; IFNAR1; AKT1; SLC6A3; SCN1A; GABRA6; EPHA1; EDNRA; PDE1C; EPHB1; IFNGR2; GABRG1; CTLA4; CSF2; RET; WEE1; PRKCB; EEF2; AR; PDE7B; TNKS; TYMS; EPHB3; LCK; GAS6; EPHA10; ROR1; GABRD; PDCD1; CD47; PRIM1; DHFR; BCL2L2-PABPN1; GABRQ; HDAC7; KCNK2; GABRP; RBX1; PTK6; GSR; AKT2; CDK6; PIK3CG; GNRHR; VDR; PDE10A; TACR1; HDAC1; DNMT3A; TEK; FLT3; MAP2K2; PDE6B; SCN2A; CYP19A1; PDE6H; EPHA5; ITGB1; PDE3B; PRKCA; PDE6D; DDR2; HDAC11; PRKCD; DDB1; KCNK9; PRKCE; PIK3CD; BCL2; GABRG3; SCN10A; MUC1; EPHB4; HDAC2; CSF2RA; NTRK1; MTOR
ovarian carcinoma,NDUFAB1; POLA2; POLD1; NDUFB4; FGFR2; POLD3; NDUFB2; POLE2; POLA1; POLD2; AKT3; NDUFA8; NDUFAF4; KDR; PARP2; NDUFA10; NDUFA2; TOP2A; CDK4; NDUFAF1; CYP19A1; NDUFA9; EPHA2; PARP1; PSEN2; NDUFB9; POLE3; NDUFV3; DDR2; NCSTN; NDUFB8; RRM1; NDUFV1; MAP2K1; NDUFA3; NDUFA11; ATR; POLD4; POLE; NDUFV2; NDUFB1; MAPK11; NDUFA13; PRIM1; MT-ND5; MT-ND3; PSENEN; MT-ND4L; DHFR; TUBB8; FLT4; PTGS2; ESR1; ABL1; TUBB1; AKT2; CDK6; FRK; GPD2; NDUFB3; CD274; MAP2K2; NDUFA5; IDO1; RAF1; KRAS; NDUFB5; TUBB2A; APH1B; NDUFB10; AKT1; NDUFS6; BRAF; CTLA4; NDUFB6; RET; WEE1; NDUFS5; TYMS; CSF1; TUBB4B; NDUFA4; TUBB; MT-ND4; FGFR1; PSEN1; AURKA; FKBP1A; NDUFB7; FLT1; TUBB4A; APH1A; NDUFA1; TUBB2B; EGFR; NDUFB11; KIT; NDUFS2; NDUFS4; TUBB6; TOP1MT; NDUFA12; NDUFA4L2; PDCD1; NTRK1; MT-ND2; MT-ND1; NDUFS3; TUBB3; NDUFS1; PARP3; PGR; NDUFC1; NDUFS8; VEGFA; PDGFRB; NDUFS7; TEK; PDGFRA; ESR2; PRIM2; NDUFC2; NDUFAF2; NDUFAF3; NDUFA6; BCR; MT-ND6; NDUFA7
ovarian clear cell adenocarcinoma,FLT4; TUBA4A; TUBB2A; TUBA3E; TUBB6; TUBA3C; TUBB3; FLT1; TUBB4A; FLT3; PDGFRA; RET; TUBA1A; CSF1R; TUBB8; TUBB1; PDGFRB; KIT; TUBA1C; TUBB4B; TUBB; VEGFA; TUBA1B; KDR; TUBB2B
ovarian clear cell cystadenocarcinoma,NDUFS1; NDUFB4; HDAC6; NDUFB7; TUBB1; NDUFS7; NDUFB3; NDUFA8; NDUFA10; NDUFA9; NDUFB9; NDUFC2; NDUFV3; HDAC11; NDUFS4; NDUFS5; TUBB6; NDUFV2; NDUFA4L2; HDAC2; MT-ND6; MT-ND2; MT-ND3; NDUFS3; HDAC7; FKBP1A; HDAC5; HDAC1; NDUFA1; TUBB2A; TUBB2B; NDUFAF1; NDUFB10; NDUFS2; NDUFAF2; NDUFB8; NDUFA3; NDUFA11; NDUFB1; NDUFA6; TUBB; CSF2RA; MT-ND5; TUBB8; NDUFAB1; HDAC4; HDAC10; NDUFC1; NDUFS8; NDUFB5; NDUFS6; HDAC3; NDUFAF3; NDUFA13; TUBB4B; TUBB3; NDUFA7; HDAC9; NDUFB2; TUBB4A; GPD2; NDUFAF4; NDUFA5; NDUFA2; HDAC8; NDUFB11; NDUFB6; NDUFV1; NDUFA12; NDUFA4; MT-ND4; MT-ND1; MT-ND4L
ovarian hyperstimulation syndrome,PGR; ESR1; PTGS1; CYP19A1; DRD2; GNRHR; NR3C1; LHCGR; NR3C2; DRD4; PTGS2; DRD3; CYSLTR1
ovarian leiomyosarcoma,POLE2; POLA1; PRIM2; POLD4; PRIM1; POLD2; RRM1; POLD1; POLD3; POLE; POLA2; POLE3
ovarian mucinous adenocarcinoma,TUBB1; TUBB2A; TUBB; TUBB8; TUBB2B; TUBA1A; TUBB6; TUBB4B; TUBA3C; VEGFA; TUBA4A; TUBB3; TUBB4A; TUBA1B; TUBA3E; TUBA1C
ovarian mucinous cystadenocarcinoma,HDAC9; POLD1; POLE2; TUBB2A; TUBB2B; HDAC3; POLE; HDAC2; PRIM1; CSF2RA; TUBB3; TUBB8; HDAC7; HDAC4; POLD3; HDAC10; HDAC5; PRIM2; HDAC8; WEE1; POLD4; TUBB6; HDAC6; POLA1; TUBB4A; TUBB; POLA2; TUBB1; POLD2; HDAC1; POLE3; HDAC11; RRM1; TUBB4B
ovarian neoplasm,POLA2; FLT4; POLD3; FGFR1; ABL1; IL2RB; TUBB1; FLT1; NR3C1; TOP2A; PDGFRA; IGF1R; PARP1; POLE3; BRAF; TUBA1A; POLD4; POLE; TOP1MT; TUBB4B; TUBB; TUBA3C; NTRK1; TOP1; TUBB3; TUBB8; PARP3; POLD1; AKT2; POLD2; FRK; ITK; TUBA4A; RAF1; IL2RA; TUBB2A; TUBB2B; PRIM2; TUBA3E; FGFR4; RRM1; TUBA1C; TUBB6; CSF1R; LCK; MAPK11; PDCD1; PRIM1; FGFR3; PTGS2; PGR; PTGS1; TEK; CD274; FLT3; PARP2; EPHA2; EML4; KIT; RET; PLK1; FGFR2; POLE2; POLA1; TUBB4A; VEGFA; PDGFRB; AKT3; CSF3R; PGF; TUBA1B; KDR; AKT1; EGFR; DDR2; ALK; MUC16; CSF2RA
ovarian serous adenocarcinoma,TUBB1; TUBB4A; CYP19A1; TUBA3E; TUBA1C; TUBB6; TUBB4B; TUBA3C; TUBB3; FKBP1A; VEGFA; MAP2K2; TUBA4A; TUBB2A; TUBB2B; TUBB; TUBB8; PTK2B; TUBA1B; MAP2K1; PTK2; TUBA1A
ovarian serous cystadenocarcinoma,POLA2; POLD1; TUBB4A; POLD2; HDAC5; NDUFC1; NDUFA8; NDUFAF4; NDUFA2; TUBB2A; TUBB2B; NDUFAF2; WEE1; NDUFV1; NDUFAF3; NDUFA4; MT-ND3; HDAC4; POLD3; NDUFB2; GPD2; NDUFS7; HDAC1; NDUFS6; NDUFB11; NDUFS2; HDAC11; NDUFS4; POLD4; TUBB6; NDUFA4L2; NDUFA13; HDAC2; PRIM1; MT-ND6; TUBB8; NDUFAB1; NDUFS1; NDUFB7; POLE2; POLA1; NDUFS8; NDUFB3; NDUFA1; NDUFB5; NDUFAF1; NDUFA9; PRIM2; POLE3; NDUFB8; RRM1; NDUFA3; HDAC3; NDUFA11; POLE; NDUFB1; NDUFA12; NDUFA6; TUBB; NDUFS3; HDAC9; HDAC7; NDUFB4; HDAC6; HDAC10; TUBB1; NDUFA5; NDUFA10; NDUFB10; HDAC8; NDUFB9; NDUFC2; NDUFV3; NDUFB6; NDUFS5; NDUFV2; TUBB4B; CSF2RA; MT-ND2; MT-ND5; MT-ND4; MT-ND1; MT-ND4L; TUBB3; NDUFA7
ovarian sex cord-stromal tumor,TUBB2B; TUBB4B; TUBB; TUBB4A; TOP2A; TUBB2A; TUBB3; TOP2B; TUBB1; TUBB6; TUBB8
overactive bladder,POLA2; ESR1; POLE2; CHRNA4; ADRA1A; CHRM3; MMP13; PRIM2; POLE3; PTGER1; CHRM1; ADRA1B; CHRM2; SCN8A; SCN4A; SNAP25; SCN7A; PDE5A; ESR2; CHRNB2; AVPR1A; SCN11A; POLE; CHRM4; SCN5A; CHRM5; SCN10A; AVPR1B; PRIM1; POLD3; POLA1; POLD2; TACR1; SCN2A; MMP7; CACNA2D1; SCN9A; ADRA1D; POLD4; ADRB3; POLD1; SLC6A4; MMP8; AVPR2; SCN1A; SCN3A; MMP1
oxidative stress,GABRE; GLRA1; ADRA2A; GABRA2; ACE; MTNR1A; GABRA5; KCNK18; GABRQ; GABRA1; KCNK2; GABRP; GABRA6; GABRB3; KCNK9; KCNK3; GABRG3; ADRA2C; GABRD; KCNK10; CHRNE; GABRA4; GABRG2; MTNR1B; CHRNA1; GABRB2; GABRB1; CHRNG; ADRA2B; GABRA3; OPRM1; CHRND; GABRG1; CHRNB1
pain,SCN4A; CACNA2D2; ADRB1; PTGER3; GUCY1B1; CALCRL; MAOB; PTGS2; PGR; OPRK1; ACHE; GABRP; PTGS1; CHRNA4; CACNA1F; PLAT; GRIN2D; CHRNE; SLC6A4; GABRA4; CALCA; OPRM1; GABRG2; PDE4D; GRIN3B; OPRD1; FAAH; CNR1; GRIA2; CCR2; PLG; PTGER2; OPRL1; ADORA2A; SNAP25; CHRM3; NGF; CHRND; SCN2A; SCN7A; CHRNA1; SCN1A; TRPM8; AGTR1; GABRB2; GLRA1; GABRA2; CACNA2D1; CACNA1D; SV2A; CHRNB2; FDPS; PTGER1; GRIN2C; GABRB1; ADORA1; GRIK3; GRIK2; SLC18A2; AVPR1A; GABRB3; HTR3A; CA4; MTNR1A; CHRM1; ADRB2; KCNK9; SCN9A; ADRA1B; ADORA2B; GRIK1; KCNK3; PDE7B; HTR1A; OXTR; GABRG3; GRIN2A; ADRA2C; PDE4B; HTR3E; HTR3D; GABRA5; KCNK18; GABRD; ADRB3; CNR2; MAOA; TUBB; HRH1; TRPV1; SCN8A; GABBR1; DHFR; GABRQ; ADORA3; GABRA3; GABRA1; DRD4; KCNK2; KCNK10; BDKRB1; TUBB1; GABRE; SLC6A2; TRPA1; KCNN4; PDE4C; ATP4A; GNRHR; MMP8; ADRA1A; nan; GRIA3; AVPR2; DDC; GABBR2; TUBB2B; MMP7; SSTR1; SLC6A3; GABRA6; SIGMAR1; CACNA1B; DRD2; HTR3B; GRIK4; ADRA2A; NR3C2; GRIA4; SCN3A; DDB1; SCN11A; PRKCE; ADRA1D; CYSLTR1; GRIN1; SCN10A; GRIN3A; GRIN2B; PDE4A; PDE8A; CACNA1S; ESR1; RBX1; HTR2A; CA2; GRIK5; VDR; PDE8B; NR3C1; TACR1; EGR1; MTNR1B; HTR1B; TUBB2A; MMP13; HTR2C; DRD3; GRIA1; SSTR5; GABRG1; HTR4; GRM5; PTGER4; CALCB; TUBB6; HTR1D; SSTR2; CHRM2; SCN5A; MMP1; AVPR1B; PDE7A; TUBB8; ADRA2B; SSTR3; CALCR; TUBB4A; CRBN; TOP2A; CA1; CUL4A; ESR2; CACNA1C; GUCY1A2; PTGIR; GUCY1A1; CHRNB1; INSR; HTR3C; HTR1F; TUBB4B; CHRNG; TUBB3
pancreatic adenocarcinoma,PARP3; POLD3; PSEN1; NDUFB7; POLA1; TUBB4A; ATP1A3; IL1R1; NDUFA8; MAP2K2; PARP2; NDUFA10; TUBB2A; TUBB2B; APH1B; NDUFA9; PARP1; PRIM2; EGFR; POLE3; KIT; BRAF; FDPS; NDUFB6; NDUFB8; NDUFA3; POLD4; TYMS; POLE; NDUFAF3; NDUFV2; LCK; PDCD1; DPYD; TUBB; PRIM1; MT-ND6; MT-ND1; LYN; FNTB; TUBB3; TUBB8; POLA2; ATP1A2; NDUFS1; POLD1; CLDN18; GUCY2C; FGFR1; HSP90AB1; POLE2; TUBB1; POLD2; ALDH5A1; HMGCR; CCN2; NDUFB3; CD274; FLT3; CDK2; NDUFAF4; SRMS; IL1B; KDR; DNMT1; NDUFA2; BLK; IGF1R; NDUFS6; NDUFC2; NDUFS2; DDR2; CTLA4; NDUFAF2; NDUFS4; NDUFV1; FNTA; PTK2; CDK1; TUBB6; TUBB4B; NDUFA4; TLR7; SRC; MT-ND2; MT-ND5; TOP1; MT-ND4L; NDUFS3; TLR9; NDUFA7; FLT4; FGFR2; HSP90AA1; FKBP1A; FLT1; NDUFC1; VEGFA; NDUFS7; APH1A; PTK2B; CXCR4; NDUFA5; TPH1; IDO1; RAF1; ATP1A4; CDK7; NDUFB5; CDK9; TPH2; ERBB2; NDUFB11; ATP1A1; RRM1; P2RY12; MUC16; NDUFA12; NDUFA6; MAPK11; NDUFA13; BCR; MT-ND3; MT-ND4; PSENEN; FGR; NDUFAB1; BTK; FYN; NDUFB4; GSK3B; NDUFB2; ABL1; HCK; CDK6; MET; NDUFS8; VDR; FRK; PDGFRB; GPD2; DNMT3A; TEK; NDUFA1; TOP2A; PDGFRA; NT5E; CDK4; NDUFAF1; NDUFB10; EPHA2; PSEN2; AGTR1; NDUFB9; NDUFV3; NCSTN; RET; NDUFS5; MAP2K1; NDUFA11; YES1; NDUFB1; NDUFA4L2; NTRK1
pancreatic carcinoma,FGR; NDUFAB1; GABRA3; POLA2; GABRA1; TYMP; FLT4; PARP3; RRM2B; HDAC7; POLD1; NDUFB4; PRKCQ; FGFR2; EPHA8; PDE8A; POLD3; GABRP; JAK2; POLE2; CD40; PTK6; HCK; POLA1; TUBB4A; POLD2; CHRNE; HDAC5; GABRA4; IL10RA; GPD2; PRKD3; EPHA4; HDAC1; NDUFB3; NDUFA8; CD274; GHSR; NDUFA1; SRMS; PRKCG; MAP2K2; NDUFA5; NDUFA10; DNMT1; TOP2A; RAF1; PDE6B; EPHA7; CHRND; BLK; TUBB2B; PDE5A; NDUFA9; SSTR1; NDUFB10; EPHA2; AGTR1; EPHA5; NDUFS6; GABRB2; PRIM2; NDUFB11; POLE3; NDUFC2; SCN3A; EPHB1; NDUFS2; PDE9A; NDUFV3; SSTR5; GABRG1; HDAC11; CTLA4; NDUFS4; NDUFB6; NDUFB8; GABRB3; WEE1; PRKCB; HTR3A; RRM1; NDUFV1; NDUFS5; MAP2K1; CXCL8; SCN9A; NDUFA3; PRKCE; PDE3A; RARG; POLD4; TUBB6; YES1; TYMS; IMPDH2; ERBB4; CHRM2; CSF1R; EPHB3; EPHA10; NDUFB1; SCN5A; NDUFA12; NDUFA6; NDUFA13; GABRD; PDCD1; DPYD; TUBB; TLR7; CSF2RA; MT-ND6; MT-ND2; MT-ND5; MT-ND3; MT-ND4; TOP1; PDE7A; MT-ND4L; TLR9; LYN; TUBB3; TUBB8; NDUFA7; BTK; FYN; NDUFS1; PRKCH; PDE4A; RARB; TOP2B; PSEN1; AURKA; PTGS1; ABL1; PSMB5; TUBB1; MSLN; MET; HSPB1; IMPDH1; FRK; OPRM1; PDE10A; VEGFA; PDE8B; PDE4D; NR3C1; PDGFRB; PDE1A; NDUFS7; MMP8; TEK; FLT3; PDE1B; NDUFAF4; KDR; NDUFA2; CHRM3; EPHB2; PDGFRA; NDUFB5; TUBB2A; MMP7; MSTN; CHRNA1; APH1B; PARP1; SCN1A; EGFR; NDUFB9; CHEK1; TUBA3E; PDE6D; IFNAR2; IL6R; FGFR4; ITGA5; NCSTN; CXCR1; NDUFAF2; SCN11A; FNTA; CHRNB1; PDE7B; FGG; FGA; NDUFA11; POLE; NDUFAF3; NDUFV2; PDE6G; BCR; TUBB4B; HDAC2; PSENEN; DHFR; FNTB; SCN4A; HDAC9; TNFRSF9; ERBB3; HDAC4; FGFR3; PTGS2; FGFR1; EPHA6; FKBP1A; NDUFB7; MAPK1; IL2RB; RBX1; GABRE; FLT1; MAPK3; PDE4C; CDK6; NDUFC1; NDUFS8; VDR; ALDH5A1; SLC29A1; HMGCR; ITK; CSF3R; CDK2; PPARG; LOXL2; CDK4; SCN7A; MMP13; NDUFAF1; ERBB2; IFNAR1; GABRA6; EPHA1; HDAC8; PDE1C; KIT; BRAF; JAK1; PRKCI; PRKCD; TUBA1A; EEF2; FGB; HDAC3; SSTR2; CXCR2; LCK; MAPK11; NDUFA4L2; PDE2A; EPOR; NDUFA4; EPHB4; MMP1; SRC; TUBA3C; PRIM1; MT-ND1; NDUFS3; LTB4R; IL10RB; SSTR3; EPHA3; F7; PRKCZ; NDUFB2; HDAC6; PDE6C; HDAC10; EPHB6; CXCL12; ALDH2; GABRG2; CRBN; APH1A; SERPINC1; CCN2; DNMT3A; TNFRSF10B; CXCR4; TUBA1B; TUBA4A; SMO; DLL4; PARP2; RARA; SNAP25; SSTR4; PDE6A; IL2RA; SCN2A; PDE6H; CUL4A; IGF1R; PDPK1; PSEN2; ITGB1; GABRA2; PDE3B; PRKCA; GART; DDR2; GABRB1; TLR3; RET; TUBA1C; DDB1; GABRG3; PRKD1; PDE4B; SCN10A; ROR1; GABRA5; CHRNG; SCN8A; NTRK1; TXNRD1; MUC5AC; GABRQ
pancreatic ductal adenocarcinoma,NDUFAB1; POLA2; FLT4; PARP3; POLD1; POLD3; JAK2; NDUFB7; POLE2; PSMB5; TUBB1; NR3C1; CCR2; NDUFAF4; NDUFA1; TUBB2B; NDUFA9; PIK3R5; AGTR1; NDUFS2; NDUFV3; CTLA4; NDUFB6; RRM1; POLD4; TUBB6; TYMS; POLE; NDUFA12; NDUFA13; TUBB4B; PRIM1; MT-ND4; MT-ND1; TOP1; MT-ND4L; TUBB8; TUBB4A; POLD2; NDUFS8; VDR; NDUFS7; NDUFB3; CD274; PTK2B; KDR; NDUFA5; NDUFA2; TOP2A; TUBB2A; NDUFAF1; PRIM2; NDUFB11; JAK1; NDUFB8; NDUFS5; PTK2; NDUFAF3; NDUFB1; NDUFA4L2; TUBB; MT-ND6; MT-ND2; MT-ND5; TUBB3; NDUFA7; NDUFB2; POLA1; FLT1; PIK3R2; CDK6; SLC6A4; GPD2; PIK3CA; NDUFA10; CDK4; NDUFB5; PARP1; NDUFS6; PIK3R1; NDUFB9; POLE3; NDUFS4; PSCA; NDUFV1; NDUFA3; PIK3CD; NDUFA11; NDUFV2; NDUFA6; DPYD; MT-ND3; NDUFS1; PIK3CB; NDUFB4; PIK3CG; NDUFC1; PIK3R3; NDUFA8; SMO; PARP2; IDO1; NDUFB10; NECTIN4; NDUFC2; NDUFAF2; PLK1; PDCD1; NDUFA4; MTOR; NDUFS3
pancreatic endocrine carcinoma,PDGFRB; CSF3R; KDR; KIT; SSTR5; MTOR; FLT4; TOP2B; FLT1; FLT3; PDGFRA; RET; TYMS; SSTR3; TOP2A; SSTR4; SSTR2; CSF1R; FKBP1A; VEGFA; SSTR1; TOP1
pancreatic neoplasm,POLD1; PTGS2; POLD3; POLE2; VEGFA; MAP2K2; PRIM2; MS4A1; GART; SSTR5; ADRB2; ALK; POLD4; TUBB6; TYMS; POLE; TUBB4B; DPYD; TUBB; PRIM1; TUBB8; ADRB1; TUBB1; FLT1; NR3C1; KDR; TUBB2A; TUBB2B; POLE3; KIT; RET; PRKCB; RRM1; SSTR2; TOP1; DHFR; POLA2; FLT4; POLA1; MET; POLD2; PGF; EML4; DRD3; TUBB3; SSTR3; TYMP; FGFR1; TUBB4A; PDGFRB; TXN; SSTR1; EGFR; PLK1; MAP2K1; PDCD1
pancreatic neuroendocrine tumor,NDUFS1; NDUFB7; RBX1; PIK3CG; PDGFRB; GPD2; PIK3CA; NDUFA10; NDUFA2; SSTR1; KIT; SSTR5; DDB1; NDUFA11; NDUFV2; SSTR2; CSF1R; NDUFB1; NDUFA12; NDUFA4L2; MT-ND4; MT-ND1; NDUFS3; SSTR3; FLT4; FKBP1A; NDUFB2; PIK3R2; CRBN; EPAS1; PIK3R3; FLT3; NDUFA1; KDR; PDGFRA; CDK4; NDUFB5; CUL4A; NDUFB10; PIK3R1; NDUFC2; NDUFAF2; NDUFB6; RET; NDUFS5; PIK3CD; TYMS; NDUFA13; MTOR; MT-ND4L; NDUFB4; NDUFB3; NDUFAF4; NDUFA5; SSTR4; PIK3R5; NDUFB11; NDUFB9; NDUFB8; NDUFA3; NDUFAF3; NDUFA6; MT-ND6; MT-ND2; MT-ND5; NDUFA7; NDUFAB1; PIK3CB; FLT1; CDK6; NDUFC1; NDUFS8; NDUFS7; NDUFA8; NDUFAF1; NDUFA9; NDUFS6; NDUFS2; NDUFV3; NDUFS4; NDUFV1; NDUFA4; MT-ND3
pancreatitis,PTGS2; SCTR; ADRA2A; PTGS1; OPRM1; NR3C1; SSTR3; SSTR4; SSTR2; ADRA2C; ADRA2B; SSTR1; SSTR5
panic disorder,GABRA1; ADRB1; SLC6A4; GABRG2; HCRTR2; GABRA2; HTR1A; SLC6A2; HTR2C; CACNA1B; DRD2; GABRG1; SLC6A9; GABRA3; HTR2A; HCRTR1; HTR3A; ADRB2; KCNK9; GABRG3; SV2A; KCNK3; GABRA5; HRH1
papillary renal cell carcinoma,FGFR3; FGFR1; MET; ENG; CD274; PDGFRA; KIT; BRAF; NPM1; CSF1R; FLT1; VEGFA; PDGFRB; KDR; ALK; FLT4; ITK; RET; FLT3; RAF1; EML4; EGFR; LCK; PDCD1
papillary thyroid carcinoma,HDAC7; HSP90AA1; MET; VEGFA; PDGFRB; CD274; DNMT1; RAF1; EGFR; EPHA1; HDAC8; KIF5B; ALK; CSF1R; EPHB3; FLT4; EPHA3; HDAC9; EPHA6; HSP90AB1; PTK6; FLT1; EPHB6; CCDC6; HDAC5; EPHA4; PGF; TEK; FLT3; KDR; EPHA2; EPHA5; HDAC11; RET; EPHA10; EPHA8; HDAC6; HDAC1; EPHB2; EPHA7; KIT; ERBB4; HDAC2; ERBB3; HDAC4; HDAC10; PSMB5; DNMT3A; MAP2K2; PDGFRA; ERBB2; EML4; EPHB1; BRAF; CTLA4; TSHR; MAP2K1; HDAC3; EPHB4; SRC
paranasal sinus neoplasm,TUBB1; TUBB2A; TUBB6; TYMS; TUBB8; TUBB; TUBB3; TUBB4A; TUBB2B; RRM2; TUBB4B
parathyroid disease,CALCR; CASR; SCN3A; SCN10A; VDR; SCN11A; SCN9A; SCN4A; SCN2A; SCN1A; SCN8A; SCN7A; SCN5A
paroxysmal familial ventricular fibrillation,CACNA1C; CACNA1D; SCN8A; SCN3A; SCN11A; SCN5A; SCN10A; SCN4A; CACNA1S; CACNA1F; SCN2A; SCN9A; SCN7A; SCN1A
paroxysmal nocturnal hemoglobinuria,POLE2; IMPDH1; C5; C3; RRM1; POLD4; POLA2; POLD1; POLA1; POLE3; IMPDH2; CFD; PRIM1; LTB4R2; POLD3; POLD2; PRIM2; CFB; FKBP1A; POLE; LTB4R; DHFR
partial epilepsy,GABRA3; PTGS2; GABRP; PTGS1; CA2; GRIK5; GABRA4; GABRG2; GRIA3; SCN2A; SCN7A; SCN1A; GABRB2; GRIK4; GRIA4; CACNA2D1; SLC6A1; CACNA1D; GABRG1; GRIK3; SCN11A; SCN9A; GABRG3; GABRA5; GABRD; SCN8A; SCN4A; GABRA1; CACNA1S; GABRE; GRIA2; GABRA6; CACNA1C; GABRA2; SCN3A; CA4; GABRQ; CACNA1F; SV2C; SV2A; GRIK2; GABRB3; GRIK1; SCN5A; SCN10A; CASP1; CACNA1B; GRIA1; GABRB1; SV2B
pelvic organ prolapse,ESR1; PLG; SCN7A; CACNA2D1; SCN11A; PTGS2; NR3C1; SCN2A; SCN9A; SCN10A; SCN4A; PTGS1; VDR; FAAH; CHRM3; SCN1A; SCN3A; CHRM2; SCN8A; SCN5A; TRPV1
pemphigus,CSF3R; MS4A1; PTGS1; NR3C1; TRPV1; BTK; PTGS2; FAAH; PPAT; HRH1; TNF
pemphigus vulgaris,BTK; NR3C1; CD80; IL2RA; TNFRSF13C; IMPDH2; MAPK14; CD86; TNF; IL2RB; IMPDH1; PPAT; MS4A1; PIK3CD
penile cancer,TUBB2A; EGFR; TUBB6; TOP1; TUBB; TUBB3; TUBB1; TUBB4A; TUBB2B; TUBB4B; TUBB8
penile neoplasm,TUBA4A; TUBA3E; TUBB1; TUBA1B; TUBB2A; TUBB2B; ERBB2; EGFR; ERBB4; TUBB4B; TUBB; TUBA3C; TUBB4A; TUBA1C; TUBB6; TUBA1A; TUBB3; TUBB8
periarthritis,NR3C1; SCN2A; SCN9A; SCN1A; SCN3A; SCN8A; SCN7A; SCN5A; SCN10A; SCN4A; SCN11A
pericardial effusion,TUBB1; TUBB; TUBB8; TUBB4B; TUBB3; PTGS2; PTGS1; TUBB4A; PLG; TUBB2B; TUBB6; TUBB2A
pericarditis,TUBB1; TUBB4A; IL1R1; IL1B; TUBB6; TUBB4B; TUBB; NR3C1; CNR1; TUBB2B; TLR7; TUBB2A; TLR9; PTGS2; PTGS1; TUBB3; TUBB8
periodontal disorder,SCN4A; HMGCR; SCN10A; SCN8A; MTNR1B; SCN7A; SCN3A; SCN11A; SCN9A; SCN5A; PTGS2; PTGS1; MMP8; MMP7; MMP13; SCN1A; MMP1; SCN2A; FDPS; MTNR1A
periodontitis,NDUFAB1; NDUFB4; PTGS2; NDUFB2; PTGS1; NDUFB7; MMP8; ADRA1A; NDUFAF4; NDUFA1; NDUFA2; NDUFA9; NDUFB9; ADRA2A; FDPS; NDUFS4; NDUFV1; SCN11A; MTNR1A; ADRB2; NDUFAF3; ADRA2C; NDUFA12; NDUFA13; NDUFA4; MMP1; MT-ND2; MT-ND4L; NDUFS1; ADRB1; NDUFC1; HMGCR; NDUFA8; SCN2A; SCN7A; MMP7; MMP13; SCN1A; NDUFB11; SCN3A; NDUFV3; NDUFAF2; NDUFB8; SCN9A; CYSLTR1; SCN5A; PPIA; SCN8A; MT-ND3; MT-ND4; SCN4A; FGFR2; NDUFS8; GPD2; MTNR1B; NDUFS6; NDUFC2; NDUFS5; ADRA1B; NDUFA3; ADRA1D; SCN10A; NDUFA4L2; ADRB3; MT-ND6; NDUFS3; NDUFS7; NDUFB3; NDUFA5; NDUFA10; NDUFB5; NDUFAF1; NDUFB10; NDUFS2; NDUFB6; NDUFA11; NDUFV2; NDUFB1; NDUFA6; MT-ND5; MT-ND1; NDUFA7; ADRA2B
peripheral arterial disease,NDUFS1; PTGS1; TUBB1; TNNC2; HTR2A; SLC6A2; NDUFS8; VDR; HMGCR; NDUFS7; NDUFA8; CSF3R; NDUFA1; PTGER2; F10; NDUFA10; TNNT3; TNNI2; NDUFA2; TUBB2A; NDUFAF1; PDE5A; NDUFB10; NDUFB9; NDUFC2; NDUFV1; P2RY12; TUBB6; NDUFV2; NDUFB1; NDUFA6; MME; CSF2RA; MT-ND4L; NDUFAB1; NPC1L1; PTGS2; NDUFB2; NDUFB7; NDUFC1; NR3C1; GPD2; NDUFB3; ADRA1A; NDUFAF4; NDUFA5; NDUFB5; NDUFA9; NDUFB11; EDNRA; XDH; NDUFS2; ACE; PTGIR; PTGER1; NDUFB6; NDUFB8; NDUFS5; NDUFA3; PDE3A; NDUFA12; NDUFA13; NDUFA4; MT-ND6; MT-ND2; MT-ND5; MT-ND3; MT-ND4; MT-ND1; NDUFS3; TUBB8; NDUFA7; FKBP1A; TUBB4A; IL1B; AGTR1; NDUFS6; NDUFAF2; NDUFS4; ABCA1; PAH; NDUFAF3; NDUFA4L2; TUBB4B; NDUFB4; CETP; TUBB2B; NDUFV3; PCSK9; NDUFA11; F2R; TUBB; TUBB3
peripheral nervous system disease,SCN4A; SLC6A2; SCN2A; SCN7A; SCN11A; TRPV1; SCN1A; SCN3A; SCN5A; SCN10A; SCN8A; SLC6A4; CHRM1; SCN9A
peripheral neuropathy,TUBB1; SLC6A2; TUBB2B; NDUFA9; NDUFB10; SCN1A; AGTR1; NDUFS6; HTR2C; SIGMAR1; NDUFC2; MS4A1; NDUFAF2; SCN9A; TYMS; NDUFAF3; NDUFV2; GRIN2A; NDUFA13; EPOR; TUBB4B; TRPV1; SCN8A; MT-ND3; MT-ND1; MT-ND4L; TUBB3; NDUFS1; NDUFB4; SLC6A4; OPRM1; CNR1; NDUFA8; NDUFA10; NDUFA2; NDUFAF1; CACNA1B; SCN3A; NDUFV3; NDUFS4; NDUFB8; NDUFV1; SCN11A; NDUFS5; NDUFA3; TUBB6; NDUFB1; NDUFA12; SCN4A; NDUFB2; ATP4A; NDUFS8; NDUFS7; NDUFAF4; NDUFA1; NDUFA5; NDUFB5; SCN2A; SCN7A; TUBB2A; NDUFB9; CACNA2D1; NDUFS2; NDUFA11; SCN5A; SCN10A; NDUFA4L2; NDUFA4; TUBB; MT-ND6; MT-ND2; MT-ND5; MT-ND4; NDUFS3; TUBB8; NDUFAB1; NDUFB7; TUBB4A; NDUFC1; GPD2; NDUFB3; NDUFB11; NDUFB6; NDUFA6; NDUFA7
peripheral primitive neuroectodermal tumor,TUBB4A; TOP1; TUBB3; VEGFA; TUBB2B; TUBB6; TUBB4B; TUBB1; TUBB2A; TOP1MT; TUBB; TUBB8
peripheral vascular disease,PDE3A; TUBB6; TUBB2A; TUBB2B; PTGIR; VKORC1; TUBB; EGLN2; PTGER2; EGLN3; PTGER1; P2RY12; P4HTM; TUBB8; TUBB1; TUBB4A; EGLN1; TUBB4B; TUBB3
peritoneal neoplasm,POLA2; POLD1; POLD3; POLE2; POLA1; FOLR1; PARP2; TUBB2A; TUBB2B; PRIM2; RRM1; TUBB6; POLE; TUBB4B; TUBB; PRIM1; TUBB3; TUBB1; POLD2; BIRC2; VEGFA; TOP2A; CYP19A1; EGFR; CD3G; TYMS; TOP1MT; TUBB8; TUBB4A; PARP1; POLE3; ITGB1; ITGA5; CD3D; POLD4; EPOR; PDCD1; CD3E; BIRC3; PARP3; EPCAM; CD274; PRKCB
peritoneum cancer,NDUFAB1; NDUFS1; PARP3; HDAC7; POLD1; HDAC4; EPHA8; PTGS2; ABL1; TUBB1; POLA1; FLT1; TUBB4A; EPHB6; POLD2; HDAC5; NDUFS7; TEK; KDR; DNMT1; NDUFA2; TOP2A; PDGFRA; TUBB2A; TUBB2B; ESR2; NDUFB10; PDPK1; EPHA2; PARP1; EPHA5; EPHA1; NDUFB11; POLE3; CHEK1; ANGPT1; KIT; PRKCD; NDUFAF2; RET; NDUFB8; NDUFV1; DDB1; NDUFS5; MAP2K1; NDUFA3; PRKCE; NDUFA11; TUBB6; EPHA10; PRKD1; TOP1MT; EPHB4; CSF2RA; MT-ND3; TUBB3; TUBB8; POLA2; PRKCH; EPHA3; HDAC9; ERBB3; PRKCZ; FGFR3; POLD3; FGFR1; NDUFB2; IL2RB; RBX1; POLE2; PTK6; GNRHR; NR3C1; CRBN; GPD2; EPHA4; HDAC1; CDK2; MAP2K2; NDUFA5; PARP2; NDUFAF1; PRIM2; EGFR; HDAC8; EDNRA; IFNGR2; NDUFV3; HDAC11; NDUFS4; WEE1; PRKCB; RRM1; NDUFV2; ERBB4; NDUFB1; NDUFA6; NDUFA4L2; NDUFA13; BCR; PRIM1; MT-ND2; MT-ND1; TOP1; SCN4A; FLT4; FGFR2; PGR; AURKA; ESR1; ANGPT2; HDAC10; CDK6; NDUFC1; NDUFS8; OPRM1; VEGFA; PDGFRB; F3; NDUFA8; CSF3R; EPHB2; IL2RA; CDK4; CYP19A1; NDUFA9; CUL4A; NDUFS6; NDUFC2; PRKCA; BRAF; IFNAR2; GART; FGFR4; PRKCI; NDUFB6; EEF2; AR; HDAC3; POLD4; NDUFA12; PDCD1; NDUFA4; TUBB; MT-ND5; MT-ND4L; DHFR; IFNGR1; NDUFB4; PRKCQ; EPHA6; HDAC6; NDUFB7; ITK; PRKD3; NDUFB3; DNMT3A; FLT3; NDUFAF4; NDUFA1; PRKCG; NDUFA10; RAF1; EPHA7; NDUFB5; ERBB2; IFNAR1; NDUFB9; EPHB1; XDH; NDUFS2; TYMS; POLE; NDUFAF3; AURKB; MUC16; CSF1R; EPHB3; LCK; MUC1; TUBB4B; HDAC2; SRC; MT-ND6; MT-ND4; NDUFS3; NDUFA7
pharyngitis,PTGS1; FAAH; SCN2A; SCN7A; SCN1A; TRPM8; GRIN2C; SCN11A; SCN5A; SCN8A; GRIN2B; SCN4A; TRPA1; GRIN2D; OPRM1; NR3C1; SCN10A; PTGS2; ADRA2A; SCN3A; GRIN1; GRIN2A; ADRA2C; TRPV1; GRIN3A; GRIN3B; SCN9A; ADRA2B
pharynx cancer,TUBB1; TUBB3; TUBB4A; TUBB6; TUBB8; TUBB2A; TUBB2B; RRM2; TYMS; TUBB4B; TUBB
photosensitive epilepsy,CACNA1I; ALDH5A1; SCN11A; GRIA2; SCN2A; SV2A; SCN5A; SCN10A; CACNA1H; SCN8A; CACNA1G; SCN4A; GRIK5; GRIA3; SCN1A; HTR2C; GRIK4; GRIA4; SCN3A; GRIA1; GRIK2; HTR1D; SCN7A; SIGMAR1; CACNA1B; GRIK3; SCN9A; GRIK1
physical activity,NDUFA8; NDUFB5; NDUFB10; NDUFB11; NDUFB9; NDUFC2; NDUFAF2; NDUFB6; NDUFA3; NDUFV2; NDUFA4; MT-ND4; MT-ND1; NR3C1; NDUFB3; NDUFAF4; NDUFA2; NDUFAF1; NDUFS6; NDUFS2; NDUFV3; NDUFS5; NDUFA11; NDUFA6; MT-ND6; MT-ND2; MT-ND4L; NDUFS3; NDUFA7; NDUFS1; NDUFB4; NDUFB7; NDUFS8; GPD2; NDUFS7; NDUFA1; NDUFA5; NDUFA10; NDUFA9; SLC5A2; NDUFV1; NDUFB1; NDUFA12; MT-ND3; NDUFAB1; NDUFB2; NDUFC1; NDUFS4; NDUFB8; NDUFAF3; NDUFA4L2; NDUFA13; MT-ND5
pituitary-dependent Cushing's disease,PGR; CDK9; CYP17A1; CYP11B1; CDK5; SSTR2; SSTR3; HDAC1; CDK2; PPARG; CDK7; CDK1; HDAC3; CYP11B2; NR3C1; HSD11B1; SSTR1; CYP11A1; SSTR5; HDAC6; DRD2; HDAC2
plasma cell leukemia,SLAMF7; HDAC4; PSMB5; NR3C1; TOP2A; PRIM2; HDAC3; POLD4; POLE; HDAC2; CD38; HDAC7; HDAC10; POLE2; CUL4A; DDB1; POLD3; HDAC6; RBX1; POLA1; HDAC5; CRBN; HDAC1; HDAC8; POLE3; HDAC11; RRM1; POLA2; HDAC9; POLD1; POLD2; PRIM1
plasmacytoma,HDAC7; POLD3; RBX1; HDAC10; POLE2; PSMB5; CRBN; CUL4A; POLE3; RRM1; HDAC3; POLE; HDAC9; HDAC6; POLD2; HDAC1; PRIM2; HDAC8; HDAC11; DDB1; PRIM1; CD38; HDAC4; NR3C1; FDPS; POLA2; POLD1; POLA1; HDAC5; POLD4; HDAC2
pleomorphic rhabdomyosarcoma,TUBB1; FLT1; TUBB4A; TUBB2A; TUBB2B; KIT; RET; TUBB8; FKBP1A; VEGFA; RAF1; TUBB4B; FLT4; FLT3; BRAF; TUBB; TUBB3; PDGFRB; KDR; TUBB6
pleural effusion,NDUFB4; PTGS1; VEGFA; GPD2; NDUFS7; NDUFB3; NDUFA1; MMP7; NDUFB9; NDUFS5; NDUFAF3; NDUFA6; MMP1; MT-ND2; MT-ND1; NDUFA7; PTGS2; NDUFB7; PLG; NDUFA10; NDUFB5; MMP13; NDUFB10; NDUFS6; NDUFB11; NDUFC2; NDUFS2; NDUFV3; NDUFB8; NDUFA11; NDUFB1; NDUFA4; MT-ND6; MT-ND4; NDUFAB1; MMP8; AVPR2; NDUFA2; NDUFA3; NDUFV2; NDUFA12; NDUFA13; MT-ND5; NDUFS3; NDUFS1; NDUFB2; NDUFC1; NDUFS8; NDUFA8; NDUFAF4; NDUFA5; NDUFAF1; NDUFA9; NDUFAF2; NDUFS4; NDUFB6; AVPR1A; NDUFV1; NDUFA4L2; AVPR1B; MT-ND3; MT-ND4L
pneumonia,ITGA2B; CYP3A43; PTGS2; PTGS1; JAK3; NR3C1; PDGFRB; SERPINC1; IL1B; TLR4; LY96; KIT; CXCR1; CSF2; ANGPT2; PDE4C; VEGFA; HMGCR; nan; ACE; CYP3A4; CYP3A7; P2RY12; CXCR2; BCR; MMP1; TLR7; TNF; GUCY1B1; PDE4A; JAK2; CYP3A5; MMP8; IFNAR1; IL6R; JAK1; TLR9; ITGB3; DPEP1; ABL1; TYK2; VDR; PDE4D; IL1R1; MMP7; MMP13; IFNAR2; PDE4B
poisoning,CHRM1; CHRM2; ACHE; CACNA1F; CHRM3; CACNA1C; NR3C2; CACNA1S; CACNA1D; HTR3A
polycystic ovary syndrome,NDUFB4; PGR; ESR1; SLC5A1; GNRHR; NDUFC1; NDUFS8; HMGCR; NDUFS7; NDUFA8; NDUFAF4; NDUFA1; NDUFA5; NDUFA10; PPARG; MTNR1B; NDUFB5; NDUFAF1; NDUFS6; NDUFB11; NR3C2; NDUFS2; NDUFV3; NDUFAF2; NDUFS4; NDUFB8; NDUFV1; AR; FSHR; NDUFA3; NDUFAF3; NDUFV2; NDUFA12; NDUFA6; NDUFA4L2; MT-ND5; MT-ND3; MT-ND1; NDUFS3; NDUFAB1; NDUFS1; SLC6A4; VDR; NR3C1; GPD2; IL1R1; NDUFB3; CYP19A1; LHCGR; NDUFA9; NDUFB10; NDUFB9; NDUFC2; PTGDR; NDUFS5; TACR3; NDUFA11; NDUFA13; MT-ND6; MT-ND2; NISCH; NDUFB2; NDUFB7; NDUFA2; ESR2; SLC5A2; PNLIP; NDUFB1; NDUFA4; DPP4; MT-ND4; MT-ND4L; NDUFA7; GLP1R; NDUFB6; MTNR1A; LIPF
polycythemia vera,FYN; PTGS2; PTGS1; JAK2; ABL1; IMPDH1; FLT3; SRMS; CUL4A; IFNAR1; EPHA2; EGFR; NTRK2; POLE3; PDE3B; KIT; FNTA; P2RY12; PDE3A; POLD4; POLE; TMPRSS6; PRIM1; NTRK1; DHFR; KDM1A; HDAC6; FRK; MDM2; BLK; TP53; IFNAR2; JAK1; RET; DDB1; RRM2; BCR; HDAC2; POLA2; POLD1; POLD3; FKBP1A; RBX1; POLE2; HCK; PDGFRB; CRBN; RRM1; LYN; FGR; POLA1; POLD2; NR3C1; HDAC1; NTRK3; PRIM2; TERT; HDAC3; YES1; IMPDH2; LCK; SRC; FNTB
polymyalgia rheumatica,TYK2; NR3C1; IL2RA; IL6; JAK2; IL2RB; JAK3; IL17A; CD86; MS4A1; DHODH; CD80; IL1B; IL6R; JAK1; TNF
polyneuropathy,SLC6A2; SCN7A; CACNA2D1; SCN11A; SCN9A; PDE3A; SCN5A; SCN4A; CHRM3; SCN2A; CACNA1B; SCN3A; CHRM2; SCN10A; SCN8A; TTR; MS4A1; SV2A; SLC6A4; SCN1A
polyp,GABRA3; GABRA4; GABRG2; GABRB3; GABRD; GABRA1; MMP7; GABRB2; GABRA2; MMP1; GABRP; GABRE; NR3C1; MMP13; GABRG1; GABRB1; GABRG3; GABRQ; MMP8; GABRA6; GABRA5
